show_id,country,director,cast
80180591,,,"Frederick Lee, Jojo Goh, Karena Teo, Jeffrey Cheng, Janelle Chin"
81007175,Turkey,,"Ahu Türkpençe, Serkan Çayoğlu, Murat Arkin, Emir Benderlioğlu, Firat Doğruloğlu, Ahmet Pinar, Mesut Akusta"
80143556,"United Kingdom, United States",Vince Marcello,"Joey King, Joel Courtney, Jacob Elordi, Molly Ringwald"
292118,United States,Mike Judge,"Mike Judge, Bruce Willis, Demi Moore, Cloris Leachman, Robert Stack, Jacqueline Barba, Pamela Blair, Eric Bogosian, Kristofor Brown, Tony Darling, David Letterman"
81013015,United States,,"Danielle Rose Russell, Aria Shahghasemi, Kaylee Bryant, Jenny Boyd, Quincy Fouse, Peyton Alex Smith, Matthew Davis, Archie L. Winston"
81215439,United States,Vince Marcello,"Rahart Adams, Brec Bassinger, Tiera Skovbye, Larissa Albuquerque, Sarah Grey, Drew Tanner, Pauline Egan, Alex Zahara, Samuel Patrick Chu"
80156684,United States,Jesse V. Johnson,"Scott Adkins, Juju Chan, Marko Zaror, Vladimir Kulich, Charles Fathy, Matthew Marsden, Keith David, Luke Massy"
70120340,"United States, United Kingdom",Bruce Robinson,"Johnny Depp, Aaron Eckhart, Michael Rispoli, Amber Heard, Richard Jenkins, Giovanni Ribisi, Amaury Nolasco, Marshall Bell, Bill Smitrovich"
80223138,United States,,"Michelle Buteau, Ian Karmel, Taylor Tomlinson, Sam Jay, Phil Wang, Sabrina Jalees, Jak Knight, Tim Dillon"
70113306,India,Rakeysh Omprakash Mehra,"Abhishek Bachchan, Sonam Kapoor, Waheeda Rehman, Om Puri, Prem Chopra, Atul Kulkarni, Pavan Malhotra, Divya Dutta, Deepak Dobriyal, Sheeba Chaddha"
70261978,"United Kingdom, United States, Spain, Germany, Greece, Canada",Alastair Fothergill,David Attenborough
81151079,Netherlands,,
81027396,United States,,
81036338,Pakistan,Ahsan Rahim,"Ali Zafar, Maya Ali, Javed Sheikh, Mehmood Aslam, Faisal Qureshi, Nayyar Ejaz, Asma Abbas, Marhoom Ahmad Bilal, Simi Raheal, Salman Bokhari"
70197049,United States,"Mario Van Peebles, Ralph Hemecker, Gwyneth Horder-Payton, Milan Cheylov, Dean White, Michael Waxman, Bryan Spicer","Lana Parrilla, Robert Carlyle, Jared Gilmore, Jennifer Morrison, Ginnifer Goodwin, Josh Dallas, Colin O'Donoghue, Emilie de Ravin"
80119375,United States,Chris McCoy,"Nicholas Braun, Zoey Deutch, Mateo Arias, Israel Broussard, Dayo Okeniyi, Julia Garner, Kevin Chapman, Ashley Judd"
80156799,Japan,,"Nobunaga Shimazaki, Junichi Suwabe, Takahiro Sakurai, Ayane Sakura, Hochu Otsuka, Daisuke Ono, Saori Hayami, Mamoru Miyano"
80174280,Japan,,"Becky, Audrey, Mayuko Kawakita, Shimon Okura"
80157297,,,"Li Nanxing, Chen Liping, Chew Chor Meng, Tay Ping Hui, Joanne Peh, Felicia Chin, Huang Wenyong, Alan Tern"
80201815,India,Sameer Vidwans,"Priya Bapat, Siddarth Jadhav, Umesh Kamat, Sai Tamhankar, Vandana Gupte"
81035874,Egypt,Sameh Abdulaziz,"Amr Abdel-Geleel, Rania Yousef, Salloum Haddad, Hesham Al-Meligy, Farida Al-Gready, Ahmad Wafiq, Mohamed Abo El Hassan, Amr Sakr, Ahmed Gamal Saeed, Riham Ayman"
80128657,United States,Eric Juhola,
80244078,India,Gajendra Ahire,"Raghuvir Yadav, Nagraj Manjule, Anjali Patil, Kadambari Kadam, Mugdha Chaphekar, Vedashree Mahajan, Mihiresh Joshi"
81172830,Nigeria,Sunkanmi Adebayo,"Ime Bishop Umoh, Alexx Ekubo, Stanley Chibunna, Ella Betts, Adi Lev, Kemi Olofinmakin"
70287605,"France, United States, Canada",,"Anna Cummer, Janyse Jaud, Andrea Libman, Britt McKillip, Ingrid Nilson, Ashleigh Ball"
80081863,Mexico,,"Benny Emmanuel, Mayté Cordeiro, Andrés Couturier, Ricardo O'Farrill, Alondra Hidalgo, Alejandro Villeli, Sofía Niño de Rivera, Johnny Rose, Annemarie Blanco, Oscar Cheda, Paul Tei, Cydney J. Fam, Lisa Grossman"
80993613,China,,"Chen Kun, Ni Ni, Zhao Lixin, Ni Dahong, Yuan Hong, Wang Ou, Bai Jinting, Zhang Xiaochen, Mei Ting, Liu Mintao, Yu Mingjia, Hou Yansong, Hai Yitian, Shi An, Shao Tong"
80167699,"United States, Bulgaria",Castille Landon,"Daniel Sharman, Jennifer Morrison, Debra Messing, Stephen Dorff, John Cleese, Liam McIntyre, Richard Kind, Avery Arendes, Castille Landon"
70058025,United States,"Ash Brannon, Chris Buck","Shia LaBeouf, Jeff Bridges, Zooey Deschanel, Jon Heder, James Woods, Diedrich Bader, Mario Cantone, Kelly Slater, Rob Machado, Sal Masekela"
81200229,China,,"Fair Xing, Lin Yi, Daddi Tang, Yi Sha, Zhou Zixin, Zheng Yingchen, Cai Gang, Liang Aiqi, Rong Rong, He Qiang"
80192097,United States,Alex Israel,"Carson Meyer, Noah Centineo, Bianca Santos, Jackson White, Sean Russel Herman, Rosanna Arquette, Molly Ringwald, Pamela Anderson, Keanu Reeves, Goldie Hawn"
80100054,Spain,Eduardo Casanova,"Ana Polvorosa, Candela Peña, Macarena Gómez, Carmen Machi, Jon Kortajarena, Secun de la Rosa, Itziar Castro, Antonio Durán 'Morris', Joaquín Climent, Ana María Ayala, Eloi Costa"
80993656,Argentina,Pablo D'Alo Abba,"Lautaro Perotti, Tamara Kiper, Inda Lavalle, Miriam Odorico, Araceli Dvoskin, Gonzalo Ruiz, Patricio Aranguren, Marina Bellati, Luciana Fuks, Martin Slipak"
70053456,United States,Paul Feig,"Lewis Black, Wilmer Valderrama, Tyler James Williams, Gia Mantegna, Dyllan Christopher, Brett Kelly, Quinn Shephard, Paget Brewster, Rob Corddry, Dominique Saldaña"
81213894,India,Abhishek Sharma,"Sonam Kapoor, Dulquer Salmaan, Sanjay Kapoor, Sikander Kher, Angad Bedi, Koel Purie, Pooja Bhamrah, Manu Rishi Chadha"
81043343,Turkey,Tolga Örnek,"Tolga Çevik, Cengiz Bozkurt, Melis Birkan, Tuna Çevik"
80192149,Russia,Pavel Parkhomenko,"Yaroslav Zhalnin, Mikhail Filippov, Olga Ivanova, Vadim Michman, Vladimir Steklov, Viktor Proskurin, Nadezhda Markina, Daniil Vorobyov"
80173623,United States,,"Paula Patton, Devon Sawa, JR Bourne, Aria Birch, Catherine Barroll, Samantha Ferris, Imogen Tear, Daniel Bacon, Carmel Amit, Noel Johansen, Rebecca Staab"
80058852,United States,,"Mika Abdalla, Genneya Walton, Victoria Vida, Ysa Penarejo, Belle Shouse, Alyssa Lynch, Danica McKellar, Maddie Phillips, Sarah Desjardins"
80021955,United States,,"Bob Odenkirk, Jonathan Banks, Michael McKean, Rhea Seehorn, Patrick Fabian, Michael Mando, Giancarlo Esposito"
80052828,"Australia, United Kingdom, United Arab Emirates, Canada",Michael Petroni,"Adrien Brody, Sam Neill, Robin McLeavy, Bruce Spence, Jenni Baird, Chloe Bayliss, Anna Lise Phillips, George Shevtsov"
70221571,United States,,"Alex Heartman, Erika Fong, Hector David Jr., Najee De-Tiege, Brittany Anne Pirtle, Rene Naufahu"
80097141,United States,,"Jeff Daniels, Michelle Dockery, Jack O'Connell, Scoot McNairy, Merritt Wever, Thomas Brodie-Sangster, Sam Waterston, Tantoo Cardinal"
80171452,United States,,"Andrew Francis, Richard Ian Cox, Brian Drummond, Matt Hill, Ashleigh Ball, Paul Dobson"
80178724,United States,,"Paul Rudd, Aisling Bea, Desmin Borges, Zoë Chao, Karen Pittman"
80156936,India,Umesh Mehra,"Dilip Kumar, Mukul Dev, Rekha, Mamta Kulkarni, Smita Jaykar, Gulshan Grover"
80183088,Mexico,"Raúl Campos, Jan Suter",Alexis de Anda
81034697,France,,"Augusto Madeira, Érico Brás, Gustavo Machado, Dionisio Neto, Fernanda Vianna, Georgina Castro, Leo Miranda, Marat Descartes, Mauricio Tarcinalli Barros, Sabrina Greve, Sérgio Malheiros"
81077795,United States,Ron Davis,
81029884,South Korea,,"Sung Hoon, Kwon Yuri, Tae Hang-ho, Joo Jin-mo, Shim Hye-jin, Ji Su-won, Park Cheol-min, Kim Seong-won, Kang Yoon, Seo Eun-ah, Bae Yoon-kyung"
80052683,"Denmark, Zimbabwe",Camilla Nielsson,
80217312,"United Kingdom, Canada",David Bruckner,"Rafe Spall, Arsher Ali, Robert James-Collier, Sam Troughton"
80211136,Australia,,"Anna Torv, Jacki Weaver, Dan Wyllie, Alex Dimitriades, Damon Herriman, Mekhi Phifer, Eugenia Yuan, Matt Zeremes, Alan Dale"
81035117,Canada,,"Michela Luci, Jamie Watson, Eric Peterson, Anna Claire Bartlam, Nicolas Aqui, Cory Doran, Julie Lemieux, Derek McGrath"
60036691,United States,Jennie Livingston,
80097390,"Germany, United States",Chad Hartigan,"Markees Christmas, Craig Robinson, Lina Keller, Carla Juri, Jakub Gierszal, Levin Henning, Eva Loebau"
80148162,"Indonesia, United States",Timo Tjahjanto,"Joe Taslim, Iko Uwais, Asha Kenyeri Bermudez, Sunny Pang, Salvita Decorte, Abimana Aryasatya, Zack Lee, Dimas Anggara, Julie Estelle, Dian Sastrowardoyo"
81061410,United States,Adam Marino,"Mira Sorvino, Kristoffer Polaha, Doug Jones, Paul Sorvino, Aaron Farb, Ser'Darius Blain, Christopher Backus, Christopher Masterson, Tommy Kijas, Kee Seymore, Marla Adams"
80213322,United States,,James Davis
80131375,,,"Tomasz Jachimek, Jacek Stramik"
80198771,South Korea,Geun-hyun Cho,"Goo Jin, Hye-jin Han, Soo-bin Bae, Seul-ong Im, Kyeong-yeong Lee, Gwang Jang, Deok-jae Jo, Eui-sung Kim, Seok-Hwan An, Bok-gi Min"
80117809,United States,,"Sierra Capri, Jason Genao, Brett Gray, Diego Tinoco, Julio Macias, Jessica Marie Garcia, Ronni Hawk, Peggy Ann Blow, Paula Garcés, Danny Ramirez"
372195,United States,Tom Holland,"Catherine Hicks, Alex Vincent, Brad Dourif, Chris Sarandon, Dinah Manoff, Tommy Swerdlow, Jack Colvin, Neil Giuntoli, Juan Ramírez, Alan Wilder"
80023667,United States,Mitch Schauer,"Mick Wingert, Matthew Mercer, Travis Willingham, Fred Tatasciore, Grey DeLisle, Troy Baker, Antony Del Rio, Trevor Devall, Kevin Michael Richardson, Steve Blum, Jane Singer"
80029901,"United Kingdom, New Zealand",John Maclean,"Kodi Smit-McPhee, Michael Fassbender, Ben Mendelsohn, Caren Pistorius, Rory McCann, Andrew Robertt, Edwin Wright, Kalani Queypo"
80145805,Japan,,"Ryuichi Kijima, Hiroaki Hirata, Kazuya Nakai, Sayaka Ohara, Daisuke Sakaguchi, Maaya Sakamoto"
80128690,Mexico,Isaac Ezban,"Gustavo Sánchez Parra, Cassandra Ciangherotti, Fernando Becerril, Humberto Busto, Carmen Beato, Santiago Torres, María Elena Olivares, Catalina Salas, Luis Alberti, Alberto Estrella, Pablo Guisa Koestinger"
80141259,,,"Juan Pablo Urrego, Amparo Grisales, Nicole Santamaría, Elkin Díaz, Francisco Javier Rueda, Ramsés Ramos, Lina Marcela Castrillón, Toto Vega, Camilo Sáenz, Mijail Mulkay, Natasha Klauss, Nelson Camayo"
80238357,United States,,"Jake Manley, Sarah Grey, Max Martini, Matt Frewer, Adam DiMarco, Katharine Isabelle, Louriza Tronco, Aaron Hale, Devery Jacobs, Thomas Elms, Dylan Playfair, Ian Tracey, Sam Trammell"
80164077,Chile,"Rodrigo Toro, Francisco Schultz",Fabrizio Copano
70084775,"United Kingdom, India",Vivek Agnihotri,"John Abraham, Bipasha Basu, Arshad Warsi, Shernaz Patel, Boman Irani, Dibyendu Bhattacharya, Gilbert Montoya, Dalip Tahil, Rajendranath Zutshi"
80166472,Russia,,"Alexander Petrov, Fillip Gorenshtein, Maksim Emelyanov, Aleksey Vesyolkin, Zoya Berber, Ieva Andrejevaite"
81012402,,,Corey Johnson
81054495,United Kingdom,Chris Howe,Mo Gilligan
80084768,India,Nidhi Sharma,"Miss Pooja, Tarun Khanna, Raj Singh Jhinger, Sahil Vedoliyaa, B.N. Sharma, Manoj Joshi, Anita Shabdeesh, Sardar Sohi"
80039717,"China, United States",Yuen Wo-Ping,"Michelle Yeoh, Donnie Yen, Harry Shum Jr., Natasha Liu Bordizzo, Jason Scott Lee, Eugenia Yuan, Roger Yuan, Juju Chan, Chris Pang, Woon Young Park, Darryl Quon"
60035875,India,Krishna Vamshi,"Karisma Kapoor, Nana Patekar, Sanjay Kapoor, Shah Rukh Khan, Deepti Naval, Vijay Raaz, Tiku Talsania, Jaspal Bhatti, Divya Dutta, Prakash Raj"
81103517,Australia,,"Dan Hong, Mark Olive, Melissa Leong, Maeve O'Meara"
81113888,India,,"Manjot Singh, Apoorva Arora, Keshav Sadhna, Shreya Mehta, Hira Ashar, Gagan Arora"
80994108,Australia,,"Lucy Durack, Antonia Prebble, Maria Angelico, Dan Spielman, Charlie Garber, Lindsay Farris, Zindzi Okenyo, Catherine McClements, Roy Billing, Magda Szubanski"
80989919,France,,"Gaspard Ulliel, Freya Mavor"
21028726,United States,Marty Callner,Jerry Seinfeld
80175798,United States,Martin Scorsese,"Robert De Niro, Al Pacino, Joe Pesci, Harvey Keitel, Ray Romano, Bobby Cannavale, Anna Paquin, Stephen Graham, Stephanie Kurtzuba, Kathrine Narducci, Welker White, Jesse Plemons, Jack Huston, Domenick Lombardozzi, Louis Cancelmi, Paul Herman, Gary Basaraba, Marin Ireland, Sebastian Maniscalco, Steven Van Zandt"
80137087,France,Hubert Woroniecki,
80216621,Brazil,,Anitta
80998564,India,B.N. Shajeer Sha,"Parvathy Ratheesh, Biju Sopanam, Sethulekshmi Amma, Molly Angamaly"
70090035,India,Ashutosh Gowariker,"Hrithik Roshan, Aishwarya Rai Bachchan, Sonu Sood, Poonam Sinha, Suhasini Mulay, Ila Arun, Raza Murad, Kulbhushan Kharbanda, Abeer Abrar"
80115118,United States,Miguel Arteta,"Alia Shawkat, Laia Costa, Mae Whitman, Hong Chau, Kate Berlant, Lindsay Burdge, Kumail Nanjiani, Mark Duplass, Jay Duplass, Jenny O'Hara"
81086435,India,Prabhuraj,"Javed Jaffrey, Vijay Raaz, Karan Aanand, Niki Walia, Meenakshi Dixit, Rishabh Chaddha, Rishina Kandhari, Kiearra Soni"
80092878,Japan,,"Haruka Fukuhara, Shunya Shiraishi, Dori Sakurada, Moe Arai, Kentaro, Shugo Nagashima, Koya Nagasawa, Hinako Tanaka, Tomoharu Hasegawa, Tomoko Fujita, Erika Mori, Kei Tanaka, Yosuke Sugino, Maryjun Takahashi, Itsuki Sagara, Madoka Yoshida"
80135360,United Kingdom,"Benjamin Turner, Gabe Turner",Usain Bolt
81070659,United States,Sebastian DiNatale,Ronny Chieng
81020161,Malaysia,Kabir Bhatia,"Puteri Aishah, Remy Ishak, Alvin Wong"
81035859,Egypt,"Mohammed El-Tahawy, Mohamed Mostafa","Khaled El Sawy, Khaled Saleh, Ruby"
70001237,India,Farhan Akhtar,"Amitabh Bachchan, Hrithik Roshan, Preity Zinta, Om Puri, Sharad Kapoor, Rajendranath Zutshi, Sushant Singh, Prashant Chainani, Shakeel Khan, Ranvir Shorey"
81009808,Canada,Carly Stone,"Timm Sharp, Hayley Law, Camila Mendes, Brett Dier, Jessica Barden, Avan Jogia"
80216172,"United Kingdom, France, Germany, Spain",,"Katherine Kelly, Lee Ingleby, Mark Stanley, Rochenda Sandall, Shubham Saraf, Nicholas Pinnock, David Tennant, Hayley Atwell, Youssef Kerkour, Clare-Hope Ashitey, Isabella Laughland"
80175348,Japan,,"Matsuya Onoe, Ren Ishikawa, Hiroyuki Onoue, Hazuki Shimizu, Sarutoki Minagawa"
80150507,Spain,,"Daniel Grao, Ginés García Millán, Óscar Hernández, Alain Hernández, Nora Navas, Lucía Díez, Jorge Kent, Ali El Aziz, Julia Carnero, David Venancio Muro, Jonás Beramí, Hugo Arbues, Natalia de Molina"
80186090,United Kingdom,,"Zoe Ball, Nadiya Hussain, Giorgio Locatelli, Rosemary Shrager"
81088277,Indonesia,Rocky Soraya,"Jessica Mila, Bianca Hello, Nabilah Ayu, Sophia Latjuba, Jeremy Thomas"
81158574,Turkey,Onur Bilgetay,"Cem Gelinoğlu, Melis Babadag, Ege Kökenli, Müfit Kayacan, Lale Başar, Ali Erkazan, Özlem Çakar, Selen Domaç, Ferdi Sancar, Güven Hokna"
80111614,China,,"Lan Cheng-lung, Sonia Sui, James Wen, Bianca Bai, George Chang, Chung Hsin-ling, Tzu-chiang Chao, Xiao Xiao Bin"
70300666,United States,"William Eubank, Will Eubank","Brenton Thwaites, Olivia Cooke, Laurence Fishburne, Beau Knapp, Lin Shaye, Robert Longstreet"
70221570,United States,,"Alex Heartman, Erika Fong, Hector David Jr., Najee De-Tiege, Brittany Anne Pirtle, Steven Skyler, Rene Naufahu, Felix Ryan, Paul Schrier"
80200942,Spain,,"Danna Paola, Miguel Herrán, María Pedraza, Itzan Escamilla, Miguel Bernardeau, Jaime Lorente, Álvaro Rico, Arón Piper, Mina El Hammani, Ester Expósito, Omar Ayuso"
80145512,United States,Brandon Dickerson,"Patrick Davis, Lisa Vidal, Josh Pence, José Zúñiga, Haley Ramm, Matt Angel, J. Michael Trautmann, Lobo Sebastian"
80244683,Mexico,Juan Carlos Rulfo,Lorena Ramírez
80075820,"United States, Mexico",,"Kelsey Grammer, Anton Yelchin, Charlie Saxton, Lexi Medrano, Fred Tatasciore, Clancy Brown, Mark Hamill, Ron Perlman, Steven Yeun, Amy Landecker, Jonathan Hyde, Anjelica Huston, Lena Headey, David Bradley, Tom Kenny, Laraine Newman, Grey Griffin, James Purefoy"
80109145,Indonesia,"Timo Tjahjanto, Kimo Stamboel","Iko Uwais, Chelsea Islan, Julie Estelle, Sunny Pang, Very Tri Yulisman, David Hendrawan, Zack Lee, Yayu Unru, Ganindra Bimo"
60020949,"United States, East Germany, West Germany",Mel Stuart,"Gene Wilder, Jack Albertson, Peter Ostrum, Roy Kinnear, Julie Dawn Cole, Leonard Stone, Denise Nickerson, Dodo Denney, Paris Themmen, Ursula Reit"
80183051,,,"Nao Toyama, Jun Fukuyama, Katsuyuki Konishi, Yoko Soumi, Kana Asumi, Akira Ishida, Aoi Yuki, Kazuhiko Inoue, Yoko Hikasa, Hirofumi Nojima, Ryotaro Okiayu, Eri Kitamura, Mamiko Noto, Ryo Hirohashi, Shizuka Ito, Hisao Egawa, Mayumi Asano, Kenta Miyake, Ai Kakuma, Kaito Ishikawa, Mikako Komatsu, Daisuke Sakaguchi, Takanori Hoshino, Kenjiro Tsuda, Nozomu Sasaki, Kenji Nojima, Houko Kuwashima, Kensho Ono, Takahiro Sakurai, Haruka Chisuga, Yu Shimamura, Takuma Terashima, Takuya Sato, Junko Minagawa, Masashi Sugawara, Sho Hayami, Kazuyuki Okitsu, Minako Kotobuki"
80183783,United States,John Ridley,
81035840,Egypt,"Hassan Hegazy, Shady Ali","Ahmed Rizk, Bosy, Bayoumi Fouad, Mahmoud Ellithy, Hayatem, Hesham Ismail, Tamer Shaltout, Alaa Morsy"
70307648,"United Kingdom, Brazil, Germany",Stephen Daldry,"Wagner Moura, Martin Sheen, Rooney Mara, Selton Mello, José Dumont, Nelson Xavier, Eduardo Luis, Gabriel Weinstein, Rickson Tevez"
70242536,"Hong Kong, China",Yee Tung-Shing,"Tony Leung Chiu Wai, Lau Ching Wan, Zhou Xun, Wu Gang, Ni Yan, Paul Chun, Kenya Sawada, Lam Suet"
80158480,India,Mohammed Hussain,"Danny Denzongpa, Mahendra Sandhu, Rekha, Faryal, Helen, Jagdeep"
81047899,Indonesia,Kuntz Agus,"Fedi Nuril, Laudya Cynthia Bella, Raline Shah, Sandrinna Michelle, Kemal Pahlevi, Tanta Ginting, Zaskia Adya Mecca, Landung Simatupang, Ray Sitoresmi, Vitta Mariana Barrazza"
70044870,"United States, Germany",Richard Donner,"Bruce Willis, Mos Def, David Morse, Jenna Stern, Cylk Cozart, Casey Sander, David Zayas, Robert Racki, Patrick Garrow, Sasha Roiz"
70083532,United States,Leslie Iwerks,Stacy Keach
80163530,,,"Loo Aye Keng, Kyo, Jojo Goh, Fabian Loo, Emily Chan"
80176842,South Korea,Jung-ah Im,"Ho-dong Kang, Soo-geun Lee, Sang-min Lee, Young-chul Kim, Jang-hoon Seo, Hee-chul Kim, Kyung-hoon Min"
60021906,India,David Dhawan,"Govinda, Mohnish Bahl, Sharad Kapoor, Satish Kaushik, Anupam Kher, Kiran Kumar, Rambha, Sushmita Sen"
81016360,United States,Mario Mattei,
80097424,United States,Peter Chelsom,"Gary Oldman, Asa Butterfield, Carla Gugino, Britt Robertson, BD Wong, Janet Montgomery, Trey Tucker"
81075519,Vietnam,Le Van Kiet,"Ngo Thanh Van, Phan Thanh Nhien, Mai Cat Vi, Thanh Hoa, Pham Anh Khoa"
80191048,,Bent-Jorgen Perlmutt,
70020730,United Kingdom,Matthew Vaughn,"Daniel Craig, Colm Meaney, Kenneth Cranham, Sienna Miller, Tom Hardy, Michael Gambon, George Harris, Jamie Foreman, Marcel Iures, Ben Whishaw, Tamer Hassan"
80058248,United States,Chuck Russell,"John Travolta, Christopher Meloni, Amanda Schull, Sam Trammell, Patrick St. Esprit, Rebecca De Mornay, Asante Jones, Paul Sloan, Luis Da Silva Jr., Jordan Whalen"
80150502,Hong Kong,Chun Wong,"Shawn Yue, Eric Tsang, Elaine Jin, Charmaine Fong"
70020947,"United States, Canada",Jeffrey W. Byrd,"Anthony Anderson, Jay Mohr, Kellita Smith, Nicole Ari Parker, Regina Hall, Loretta Devine, Donald Faison, Leila Arcieri, Charlie Murphy, Brooke D'Orsay"
80228322,India,Priyadarshan,"Prakash Raj, Shreya Reddy, Ashok Selvan"
70084791,"United States, United Kingdom, France",Nick Moore,"Emma Roberts, Kimberley Nixon, Juno Temple, Linzey Cocker, Sophie Wu, Alex Pettyfer, Georgia King, Natasha Richardson, Aidan Quinn, Lexi Ainsworth"
80134516,Turkey,Muharrem Gülmez,"Erdem Yener, Ayhan Taş, Emin Olcay, Muharrem Gülmez, Elif Nur Kerkük, Tarık Papuççuoğlu, Suzan Aksoy, Doğa Konakoğlu, Esin Eden, Deniz Özerman"
80230293,United States,,"Iko Uwais, Katheryn Winnick, Byron Mann, Tommy Flanagan, Li Jun Li, Celia Au, Lewis Tan, Lawrence Kao, Juju Chan, Tzi Ma, Cranston Johnson, Mark Dacascos, Kevin Durand, Jeff Fahey, Summer Glau"
81189912,India,Tarun Mansukhani,"Jacqueline Fernandez, Sushant Singh Rajput, Boman Irani, Pankaj Tripathi, Vikramjeet Virk, Sapna Pabbi, Vibha Chhibber, Kaustubh Kumar"
80187684,India,Arun Chidambaram,"Jiya Anil Manne, Arun Chidambaram, T.P. Gajendran, Gnanasambandam, M. Ilavarasu, Yog Japee, Mayilsamy, Black Pandi"
80091781,South Korea,,"Hee-ae Kim, Ah-in Yoo, Hye-jin Shim, Hyuk-kwon Park, Hye-eun Kim, Soo-jin Kyung, Yong-gun Kim, Chang-wan Kim, Tae-hwan Choi, Kan-hie Lee"
80146805,"United Kingdom, France, Belgium",Tommy Wirkola,"Noomi Rapace, Willem Dafoe, Glenn Close, Marwan Kenzari, Christian Rubeck, Pål Sverre Hagen, Tomiwa Edun, Cassie Clare, Cameron Jack, Clara Read, Robert Wagner"
80037278,France,,"Gérard Depardieu, Benoît Magimel, Géraldine Pailhas, Nadia Farès, Stéphane Caillard, Jean-René Privat, Pascal Elso, Gérard Meylan"
81045060,India,Lenin Bharathi,"Antony, Gayathri Krishna, Abu Valayamkulam, Anthony Vaathiyaar, Aarubala, Sornam"
81161538,Brazil,,
70021654,"United States, Czech Republic",Shawn Levy,"Steve Martin, Kevin Kline, Beyoncé Knowles-Carter, Jean Reno, Emily Mortimer, Henry Czerny, Kristin Chenoweth, Roger Rees, Philip Goodwin, Henri Garcin, William Abadie"
80227959,United Kingdom,,"Tom Dyckhoff, Daniel Hopwood, Sophie Robinson"
80205563,Japan,Takuya Inaba,
70177034,Japan,,"Dan Green, Eric Stuart, Amy Birnbaum, Darren Dunstan, Wayne Grayson, Tara Sands, Lisa Ortiz, Megan Hollingshead, Madeleine Blaustein, Sam Riegel, Ted Lewis, Gregory Abbey, Jimmy Zoppi"
81172726,,Odunlade Adekola,"Odunlade Adekola, Jide Kosoko, Adunni Ade, Eniola Ajao, Ireti Osayemi, Kayode Olaseinde, Tunde Bernard, Bolaji Amusan"
80245709,United States,William H. Macy,"Rosario Dawson, Nick Robinson, Jacob Latimore, Grant Gustin, William H. Macy, Kathy Bates, Felicity Huffman, William Fichtner, T.I., Rick Fox, Amy Parrish"
80117551,United States,,"Jahi Di'Allo Winston, Peyton Kennedy, Patch Darragh, Claudine Mboligikpelani Nako, Rio Mangini, Quinn Liebling, Sydney Sweeney, Elijah Stevenson, Zachary Ray Sherman, Abi Brittle"
60031303,United States,"Lilly Wachowski, Lana Wachowski","Keanu Reeves, Laurence Fishburne, Carrie-Anne Moss, Hugo Weaving, Jada Pinkett Smith, Mary Alice, Harold Perrineau, Monica Bellucci, Harry Lennix, Lambert Wilson, Nona Gaye"
80103312,Spain,Iñaki Dorronsoro,"Alain Hernández, Javier Gutiérrez, Alba Galocha, Itziar Atienza, Luis Tosar, Florin Opritescu, Jaroslaw Bielski, Peter Nikolas"
80177406,United States,Bobcat Goldthwait,Patton Oswalt
80213020,France,,"Audrey Fleurot, Julie de Bona, Camille Lou, Gilbert Melki, Josiane Balasko, Antoine Duléry, Florence Pernel, Théo Fernandez, Victor Meutelet, François-David Cardonnel, Stéphane Guillon, Aurélien Wiik, Gilles Cohen"
80233664,Taiwan,,"Sean Huang, Chang Chia-yu, Wu Chien-ho, Teresa Daley, Yong Lea, Edison Song, Shan Cheng-ju, Iris Hu, Hsia Teng-hung"
80175405,,"Santiago Diaz, Pablo Martin Farina",
70254350,India,Rohit Shetty,"Shah Rukh Khan, Deepika Padukone, Nikitin Dheer, Satyaraj, Kamini Kaushal, Lekh Tandon, Mukesh Tiwari"
80212301,Japan,,"You, Reina Triendl, Yoshimi Tokui, Azusa Babazono, Ryota Yamasato, Shono Hayama"
80149141,"Spain, Cuba",,"Jorge Perugorría, Carlos Enrique Almirante, Mario Guerra, Luis Alberto García, Juana Acosta, Laura Ramos"
70139075,India,Vishal Bhardwaj,"Priyanka Chopra, Neil Nitin Mukesh, John Abraham, Irrfan Khan, Aleksandr Dyachenko, Annu Kapoor, Naseeruddin Shah, Vivaan Shah, Usha Uthup, Konkona Sen Sharma"
70100377,United States,John Patrick Shanley,"Meryl Streep, Philip Seymour Hoffman, Amy Adams, Viola Davis, Alice Drummond, Audrie Neenan, Susan Blommaert, Carrie Preston, Lydia Jordan, Lloyd Clay Brown"
80020935,"United States, Ireland, United Kingdom",,"Keith Wickham, Jo Wyatt, Ross Breen, Simon Greenall, Paul Panting, Rob Rackstraw, Teresa Gallagher, Shelley Longworth"
70225597,India,N. Linguswamy,"Arya, Madhavan, Sameera Reddy, Amala Paul, Nasser, Ashutosh Rana, Sreejith Ravi, Muthukumar"
81104406,Japan,,"Ayumi Fujimura, Nobuhiko Okamoto, Kazuyoshi Shiibashi, Kana Hanazawa, Yu Kobayashi, Mitsuhiro Ichiki, Takuma Terashima, Yoshimasa Hosoya"
70266069,Indonesia,Ifa Isfansyah,"Prisia Nasution, Oka Antara, Slamet Rahardjo, Dewi Irawan, Lukman Sardi, Tio Pakusadewo"
80016588,"South Africa, United States",Neill Blomkamp,"Sharlto Copley, Hugh Jackman, Sigourney Weaver, Dev Patel, Ninja, Yo-Landi Visser, Jose Pablo Cantillo, Brandon Auret, Johnny Selema, Maurice Carpede"
80107372,"United States, Canada",Ishi Rudell,"Tara Strong, Rebecca Shoichet, Ashleigh Ball, Andrea Libman, Tabitha St. Germain, Cathy Weseluck, Enid-Raye Adams, Brian Doe, Nicole Oliver"
80235025,United States,Bille Woodruff,"Teyana Taylor, Sierra Aylina McClain, Bryshere Gray"
80066806,Australia,"Susan Lambert, Stefan Moore",
70060017,"New Zealand, United Kingdom, Australia",Jay Russell,"Emily Watson, Alex Etel, Ben Chaplin, David Morrissey, Brian Cox, Priyanka Xi, Marshall Napier, Joel Tobeck, Erroll Shand, Craig Hall"
80201817,India,Avadhoot Gupte,"Santosh Juvekar, Siddharth Chandekar, Sachit Patil, Chinmay Mandlekar, Rajesh Shringarpure, Pushkar Shrotri, Tejashree Pradhan, Neha Joshi"
80114155,"Pakistan, Norway, United States",Afia Nathaniel,"Samiya Mumtaz, Mohib Mirza, Saleha Aref, Asif Khan, Adnan Shah, Ajab Gul, Abdullah Jan, Samina Ahmad, Omair Rana, Zeeshan Shafa"
80223556,United States,,"Gavin Lewis, Theodore Barnes, Shelby Simmons, Cynthia Kaye McWilliams"
81013710,India,Jatla Siddartha,"Saharsh Kumar Shukla, Taneea Rajawat, Hima Singh, Aparna Upadhyay, Loknath Tiwari, Sambhaji Sasane"
70187503,India,Anees Bazmee,"Akshay Kumar, Bobby Deol, Sonam Kapoor, Irrfan Khan, Sunil Shetty, Rimi Sen, Celina Jaitly"
80092849,Spain,Álex de la Iglesia,"Raphael, Mario Casas, Pepón Nieto, Blanca Suárez, Hugo Silva, Carmen Machi, Luis Callejo, Carlos Areces, Enrique Villén, Santiago Segura, Jaime Ordoñez, Tomás Pozzi, Carolina Bang, Ana Polvorosa, Luis Fernández"
80158649,United Kingdom,Daniel Kontur,Nicholas Day
80134434,Turkey,Ozan Açıktan,"Tolga Çevik, Köksal Engür, Pelin Körmükçü, Toprak Sergen, Zeynep Özder"
80209658,Spain,Jota Linares,"Natalia de Molina, Daniel Grao, Natalia Mateo, Ignacio Mateos, Borja Luna, Mario Tardón, Mariana Cordero"
80177300,United States,Sonny Mallhi,"James Ransone, Vinessa Shaw, Ajiona Alexus, Colin Ford"
81025019,United Kingdom,,"Jake Williamson, Rachael Dickson, Sumita Majumdar, Michael White, Tony Finnegan, Scott Mulligan, Rosie King"
80192063,Chile,"Raúl Campos, Jan Suter",Natalia Valdebenito
