show_id,country,director,cast
80224924,,Ben Wallis,Maggie Q
80149575,Argentina,Néstor Sánchez Sotelo,"Muriel Santa Ana, Peto Menahem, Héctor Díaz, Sebastián Wainraich, Karina K., Hernán Jiménez, Fabián Forte, Verónica Intile"
80175822,Japan,,"Daiki Shigeoka, Akito Kiriyama, Junta Nakama, Tomohiro Kamiyama, Ryusei Fujii, Takahiro Hamada, Nozomu Kotaki, Umika Kawashima, Takeshi Kaga, Norio Wakamoto"
80166467,United States,"Joel Gallen, Tig Notaro",Ellen DeGeneres
70123116,India,Ram Gopal Varma,"Adesh Bhardwaj, Rasika Dugal, Joy Fernandes, Ravi Kale, Ishtiyak Khan, Priyanka Kothari, Kali Prasad Mukherjee, Nitin Reddy, Gautam Rode, Howard Rosemeyer"
80177986,South Korea,,"Lee Soo-kyung, Yoon Du-jun, Yoon So-hui, Shim Hyoung-tak, Do-yeon Lee, Jang Won-young, Jung Soo-young"
80223228,India,Manish Gupta,"Kay Kay Menon, Ashish Vidyarthi, Tisca Chopra, Mita Vashisht, Bikramjeet Kanwarpal, Ashwini Kalsekar, Kunal Sharma, Nimai Bali"
81037970,Indonesia,Iman Brotoseno,"Reza Rahadian, Bunga Citra Lestari, Tara Basro, Chelsea Islan"
80123950,Mexico,,"Germán Bracco, Daniela Luque, José Antonio Becerril, Paula Serrano, Héctor Holten, Héctor Loeza, Edson Loyo, Brandon Rosas, José Sefami, Tiosha Bojórquez"
80103313,"United States, Spain",J.C. Falcón,"Sean Maher, Andrea Grano, Mark Cirillo, Nacho San José, Curt Hansen, Trey McCurley, Jimmy Shaw, Carmen Maura"
80003481,United States,James Yukich,Chelsea Handler
80173481,Thailand,,Sebastian Perry
70275751,United States,Jean-Marc Vallée,"Matthew McConaughey, Jennifer Garner, Jared Leto, Denis O'Hare, Steve Zahn, Michael O'Neill, Dallas Roberts, Griffin Dunne, Kevin Rankin, Donna DuPlantier"
81035857,,Husam El-Gohari,"Kareem Mahmoud Abdel Aziz, Mai Selim, Sad Al-Saghir, Mahmood El-Laithi, Maher Essam, Dina"
80117555,United States,,"Clare-Hope Ashitey, Regina King, Beau Knapp, Michael Mosley, David Lyons, Russell Hornsby, Raúl Castillo, Patrick Murney"
80195901,"Thailand, China, United States","Jesse V. Johnson, Jesse Johnson","Tony Jaa, Iko Uwais, Tiger Chen, Scott Adkins, Celina Jade, Michael Bisping, Michael Jai White, JeeJa Yanin, Dominiquie Vandenberg"
81036190,,"Mike Diva, Akiva Schaffer","Andy Samberg, Akiva Schaffer, Jorma Taccone, Hannah Simone, Jenny Slate, Sterling K. Brown, Jim O'Heir, Maya Rudolph, Stephanie Beatriz, Alana Haim, Este Haim, Danielle Haim"
81108280,China,,"Zhang Chao, Li Tingting, Chen Bohao, Sun Jialing, Zhang Zhang, Li Jiuxiao, Deng Yuli, Li Huan, Fang Wenqiang, Gong Rui"
80244019,Netherlands,Joram Lürsen,"Barry Atsma, Jacob Derwig, Pierre Bokma, Jaap Spijkers, Raymond Thiry, Fockeline Ouwerkerk, Matteo van der Grijn, Jochum ten Haaf, Peter Jordan, Götz Schubert"
70065769,India,Gurudev Bhalla,"Abhishek Bachchan, Hrishitaa Bhatt, Amrish Puri, Mohnish Bahl, Helen, Om Puri, Ashish Vidyarthi, A.K. Hangal, Tinnu Anand, Daisy Irani, Dara Singh, Viju Khote, Shubha Khote"
81069393,United States,,R. Kelly
80081277,"Germany, France, Luxembourg, United Kingdom, United States",Florian Gallenberger,"Emma Watson, Daniel Brühl, Michael Nyqvist, Richenda Carey, Vicky Krieps, Jeanne Werner, Julian Ovenden, August Zirner, Martin Wuttke, Stefan Merki"
70110558,"United States, Germany, United Kingdom",Guy Ritchie,"Robert Downey Jr., Jude Law, Rachel McAdams, Mark Strong, Eddie Marsan, Kelly Reilly, James Fox, Hans Matheson, Geraldine James"
81121174,United States,Giulia Clark,Eric Meyers
70271599,United States,Morgan Spurlock,"Harry Styles, Niall Horan, Zayn Malik, Louis Tomlinson, Liam Payne"
80198545,Canada,,"John Paul Tremblay, Robb Wells, Mike Smith, Tom Mayhue, Alex Lifeson, Sebastian Bach, Tommy Chong, Dennis Rodman, Tony Hawk, Verne Troyer, Tom Green, Riley Hawk"
80106338,United Kingdom,,
80187302,South Korea,,"Seung-woo Cho, Doona Bae, Joon-hyuk Lee, Kyeong-yeong Lee, Jae-myung Yoo, Hye-sun Shin"
80199767,United States,Don Mancini,"Fiona Dourif, Michael Therriault, Adam Hurtig, Alex Vincent, Jennifer Tilly, Brad Dourif, Summer H. Howell, Grace Lynn Kung, Elisabeth Rosen, Zak Santiago, Ali Tataryn"
70250364,United States,Marcus Raboy,Katt Williams
80217475,United States,,
80218448,Germany,,"Maximilian Mundt, Danilo Kamperidis, Lena Klenke, Damian Hardung, Leonie Wesselow, Luna Schaller, Bjarne Mädel, Roland Riebeling"
81025800,United States,,"Junchen Guo, Yi Ning Sun, Yi Qin Zhao, Mu Xuan Cheng, Li Ma, Mo Zhou"
70174741,United States,John Fortenberry,Whitney Cummings
80136453,,,"Henley Hii, Debbie Goh, Frederick Lee, Wymen Yang, Melvin Sia, Alvin Wong"
81054827,Belgium,,"Matteo Simoni, Tom Van Dyck, Stef Aerts, Anne-Laure Vandeputte, Jeroen Perceval, Charlotte Timmers, Dirk Roofthooft, Anemone Valcke"
80993756,,,"Lapassalal Jiravechsoontornkul, Mook Worranit Thawornwong, Jirakit Thawornwong, Sattaphong Phiangphor"
80220422,Colombia,"Luis Alberto Restrepo, Andrés Beltrán, Jaime Rayo","Luis Gerónimo Abreu, José Ramón Barreto, Ernesto Benjumea, Félix Antequera, Jefferson Quiñones, Shany Nadan, María José Vargas, Hans Martínez, Mauro Mauad, Álvaro Bayona, Rosmeri Marval, Irene Esser, Nohely Arteaga"
80078197,United States,,"Adriano Moraes, J.B. Mauney, Silvano Alves, Kaique Pacheco, Guilherme Marchi, Robson Palermo"
81019888,United States,Chris Nelson,"Noah Centineo, Laura Marano, Camila Mendes, Odiseas Georgiadis, Matt Walsh, Joe Chrest, Carrie Lazar, Alex Biglane, Blaine Kern III, Zak Steiner"
70298389,United Kingdom,Matt Askem,"Tim Minchin, Jules Buckley"
80118873,United Kingdom,,Mark Bazeley
70125581,United States,Oren Peli,"Katie Featherston, Randy McDowell, Amber Armstrong, Mark Fredrichs, Micah Sloat, Ashley Palmer, James Piper"
70287604,United States,,"David Lodge, Patty Mattson, Doug Erholtz, Stephanie Sheh, Nayo Wallace, Michael Sinterniklaas, Michaela Dean"
80004534,United States,Lance Bangs,Chelsea Peretti
81035852,,Tamer Bassiouni,"Sameh Hussain, Menna Arafa, Merna al-Mohandes"
80228321,India,"Ajay Bhuyan, Kunal Kohli","Kunal Kohli, Jennifer Winget, Sumona Chakravarti, Sushmita Mukherjee, Kanwaljit Singh, Dalip Tahil, Rajit Kapoor"
80105690,"Spain, Argentina",Gerardo Olivares,"Maribel Verdú, Joaquín Furriel, Joaquín Rapalini"
70261674,United Kingdom,Richard Curtis,"Domhnall Gleeson, Rachel McAdams, Bill Nighy, Lydia Wilson, Lindsay Duncan, Richard Cordery, Tom Hollander, Margot Robbie, Joshua McGuire, Vanessa Kirby"
80244123,Mexico,Pepe Bojórquez,"Omar Chaparro, Ana Claudia Talancón, Stephanie Cayo, Yare Santana, Angélica María, Manuel 'Flaco' Ibáñez, Laura De Ita"
80191036,United States,,
80164392,Australia,Cate Shortland,"Matthias Habich, Max Riemelt, Teresa Palmer, Lucie Aron, Emma Bading"
80049870,United States,,"Stephanie Lemelin, A.J. LoCascio, Dan Milano, Grey DeLisle, Cree Summer, Laraine Newman, Chris Parnell, Ana Gasteyer, Dee Bradley Baker, Thomas Lennon, Dominic Catrambone"
60000870,United States,Keenen Ivory Wayans,"Anna Faris, Jon Abrahams, Shannon Elizabeth, Shawn Wayans, Regina Hall, Marlon Wayans, Lochlyn Munro, Cheri Oteri, Carmen Electra, Dave Sheridan, Kurt Fuller, Rick Ducommun, James Van Der Beek, Keenen Ivory Wayans, Marissa Jaret Winokur, Dan Joffre"
80157488,,,"Tay Ping Hui, Joanne Peh, Shaun Chen, Rebecca Lim, Zhu Houren, Richard Low"
80005772,France,,"Damien Laquet, David Gasman, Barbara Scaff"
81019338,United States,Eva Vives,"Mary Elizabeth Winstead, Common, Kate del Castillo, Chace Crawford, Jay Mohr, Beau Bridges, Clea DuVall, Melonie Diaz, Camryn Manheim, Mindy Sterling, Angelique Cabral, Nicole Byer, Todd Louiso, Elizabeth Masucci, Sonoya Mizuno, Charlotte Newhouse, Victor Rasuk, Andree Vermeulen"
80993794,,,"Chutavuth Pattarakampol, Sheranut Yusananda, Nichaphat Chatchaipholrat, Thassapak Hsu"
80211135,India,Pooja Bhatt,"Himesh Reshammiya, Sara Loren, Amrita Singh, Gulshan Grover, Javed Sheikh, Adnan Shah, Natasha Sinha, Gaurav Chanana, Anupam Shyam"
80124680,France,Mario Rouleau,Gad Elmaleh
81173255,Canada,Chad Archibald,"Nina Kiri, Ry Barrett, Jorja Cadence, Will King, Nina Richmond"
80142474,United States,"Grant S. Johnson, Ippsie Jones","Connor Lawrence, Justin Mark, Cathryn Dylan, Chris Elliott, Tyler Weaks, Max Sheldon, Austin Ramsey, Peter O'Connor, Nicole Balsam, Kaitlin Mesh"
11819467,"United States, Japan",Roland Emmerich,"Matthew Broderick, Jean Reno, Maria Pitillo, Hank Azaria, Kevin Dunn, Michael Lerner, Harry Shearer, Arabella Field, Vicki Lewis, Doug Savant, Malcolm Danare"
81172568,,,"Laura Stahl, Billy Kametz, Derek Stephen Prince, Kyle McCarley, Brandon Winckler, Kimlinh Tran"
81041182,United States,,"Allie Gallerani, Beverly D'Angelo, Olivia Luccardi, Stephanie Simbari, Nick Clark, Brian Wiles"
70113005,"South Africa, United States, New Zealand, Canada",Neill Blomkamp,"Sharlto Copley, Jason Cope, David James, Vanessa Haywood, Mandla Gaduka, Kenneth Nkosi, Eugene Khumbanyiwa, Louis Minnaar, William Allen Young, Nathalie Boltt"
70185141,India,Satyajit Bhatkal,"Darsheel Safary, Anupam Kher, Manjari Fadnis, Tinnu Anand, Sheeba Chaddha, S.M. Zaheer, Aayam Mehta, Gargi Datar, Jai Vyas"
80061797,Italy,Riccardo Milani,"Claudio Bisio, Kasia Smutniak, Beppe Fiorello, Remo Girone, Massimo Popolizio, Cesare Bocci, Omero Antonutti, Michele Alhaique, Franco Ravera, Patrizio Rispo, Piera Degli Esposti, Gianni Cavina"
80163533,,,"Lenna Lim, Jack Tan, Rickman Chia, Rabbit Chen, Kopi Lim Guo Wei, Agnes Wang, Allan Toh, Mandy Chen, Tan Hau Yen"
81074140,United Arab Emirates,"Ibrahim Bin Mohamed, Hasan Aljaberi","Hussain Al Hosani, Ali Almarzouqi, Abdullah Al Yousef, Omar Al Hafidh, Meral Niazi, Yaser Hassan, Fatema Almansoori, Ahmed El Mohammdi"
80013267,United States,Robb Dipple,Jeff Dunham
81002592,Vietnam,Dustin Nguyen,"Chi Tai, Lan Ngoc, Dustin Nguyen, Thu Trang"
70117577,"United States, Germany",Michael Dowse,"Topher Grace, Anna Faris, Dan Fogler, Teresa Palmer, Chris Pratt, Michael Biehn, Jeanie Hackett, Lucy Punch, Michelle Trachtenberg, Demetri Martin"
80245357,"Argentina, Spain",Alejandro Montiel,"Luisana Lopilato, Amaia Salamanca, Rafael Spregelburd, Nicolás Furtado, Oriana Sabatini, Pedro Casablanc, Arancha Martí, Carlos Alcántara, María Onetto, Sara Sálamo"
80223190,India,Ashish R. Mohan,"Arshad Warsi, Jacky Bhagnani, Lauren Gottlieb, Dalip Tahil, Pavan Malhotra, Ayub Khoso, Adnan Shah"
80164930,"Japan, United States",Michael Barrett,"Logan Huffman, Natalia Warner, Brandon Sklenar, Naoto Takenaka, Asahi Uchida, Mei Kurokawa, Hisashi Miyazawa, Miho Tamaki, Seiki Chiba, Yoshimi Tachi"
70136140,United States,,"William Shatner, Leonard Nimoy, DeForest Kelley, Nichelle Nichols, James Doohan, George Takei, Walter Koenig, Grace Lee Whitney, Majel Barrett"
80104950,France,,"Patrick Ridremont, Olivier Chantreau, Pénélope Leveque, Emmanuelle Meyssignac, Salem Kali, Yann Sundberg, Victor Viel, Victor Pontecorvo, Pierre Benoist, Swann Arlaud, Phénix Brossard, Eriq Ebouaney, Tony Harrisson"
80239864,,,"Jirayu La-ongmanee, Thanapob Leeratanakajorn, Violette Wautier, Supassra Thanachat, Arachaporn Pokinpakorn"
70292992,United Kingdom,David Mackenzie,"Jack O'Connell, Ben Mendelsohn, Rupert Friend, Sam Spruell, Anthony Welsh, David Ajala, Peter Ferdinando, Gershwyn Eustache Jnr, Ashley Chin, Raphael Sowole, Gilly Gilchrist, Tommy McDonnell"
70241791,United States,,"Jack Black, Dustin Hoffman, Dennis Haysbert, Paul Scheer, Randall Duk Kim, David Cross, Jessica DiCicco, Jaycee Chan, Angelina Jolie, Seth Rogen, Tony Leondis"
1179574,"United Kingdom, United States",Paul W.S. Anderson,"Laurence Fishburne, Sam Neill, Kathleen Quinlan, Joely Richardson, Richard T. Jones, Jack Noseworthy, Jason Isaacs, Sean Pertwee"
80065220,United States,"Wade Allain-Marcus, Jesse Allain-Marcus","Wade Allain-Marcus, Arjun Gupta, Melina Lizette, Elsa Biedermann, Katie Blake, Santana Dempsey"
80144803,United States,Vikram Gandhi,"Devon Terrell, Anya Taylor-Joy, Jason Mitchell, Ashley Judd, Jenna Elfman, Ellar Coltrane, Avi Nash, Linus Roache, John Benjamin Hickey"
81037733,United States,Michael Doneger,"Alex Russell, Rose McIver, Jean Smart, Scott Porter, Kevin Linehan, Spencer Grammer, Carter Hastings, Riley Voelkel, John Getz"
80119249,United States,Leif Tilden,"Billy Crudup, Graham Rogers, Liana Liberato, Stefanie Scott, Tim Roth, Melanie Lynskey, Thomas Cocquerel, Peter Coyote"
80997687,United Kingdom,,"Claes Bang, Dolly Wells, John Heffernan"
80215046,Canada,Jennifer Westcott,"Josh Hutcherson, Samantha Bee, Martin Short, Morena Baccarin, Jeff Dunham, John Cleese"
80134109,Taiwan,,"Marcus Chang, Ivy Shao, Mini Tsai, Yorke Sun, Ray Yang, Chang Chieh"
80211380,"United Kingdom, United States",Anthony Byrne,"Natalie Dormer, Ed Skrein, Emily Ratajkowski, Neil Maskell, Jan Bijvoet, James Cosmo, Joely Richardson"
80163156,United States,Michael Bonfiglio,Jerry Seinfeld
70176967,India,Nikhil Advani,"Rishi Kapoor, Dimple Kapadia, Akshay Kumar, Anushka Sharma, Tinnu Anand, Soni Razdan, Prem Chopra, Masood Akhtar, Jeneva Talwar, Suparna Marwah"
70109689,United States,Steve Carr,"Kevin James, Keir O'Donnell, Jayma Mays, Raini Rodriguez, Shirley Knight, Stephen Rannazzisi, Peter Gerety, Bobby Cannavale, Adam Ferrara, Jamal Mixon, Adhir Kalyan, Gary Valentine"
80044126,United States,Jay Chapman,D.L. Hughley
81177238,India,Mangesh Hadawale,"Meezaan Jaffrey, Sharmin Segal, Chinmaya Surve, Anil Gawas, Sonal Jha, Sanjay Gurbaxani, Sameer Dharmadhikari, Deepak Damle"
80990869,Canada,Jean-François Blais,Martin Matte
70185139,India,Habib Faisal,"Rishi Kapoor, Neetu Singh, Aditi Vasudev, Archit Krishna, Akhilendra Mishra, Natasha Rastogi, Manoj Bakshi, Supriya Shukla"
80161851,United States,"Oscar Micheaux, Spencer Williams, Richard E. Norman, Richard Maurice",
80160358,France,"Thierry Demaizière, Alban Teurlai",Rocco Siffredi
70236586,"United Kingdom, India",Priyadarshan,"Anil Kapoor, Ajay Devgn, Boman Irani, Kangna Ranaut, Zayed Khan, Mallika Sherawat, Avika Gor, Dominic Power, Sameera Reddy, Mohanlal"
80164088,United States,Dimitri Logothetis,"Alain Moussi, Jean-Claude Van Damme, Mike Tyson, Christopher Lambert, Sara Malakul Lane, Hafþór Júlíus Björnsson, Sam Medina, Steven Swadling"
80161335,United Kingdom,,"Sean Bean, Tom Ward, Richie Campbell, Vanessa Kirby, Ed Stoppard, Ryan Sampson, Robbie Gee, Anna Maxwell Martin, Elliot Cowan, Charlie Creed-Miles, Eloise Smyth, Samuel West"
80201816,India,"Sudesh Manjrekar, Atul Kale","Sudhir Joshi, Vandana Gupte, Ankush Chaudhari, Madhura Velankar, Sanjay Mone, Anand Abhyankar"
70206822,United States,Arthur Allan Seidelman,"Nancy McKeon, Valerie Harper, Stephen Macht, Tricia Leigh Fisher, Millie Perkins"
80170301,"China, India, Nepal",Stanley Tong,"Jackie Chan, Disha Patani, Amyra Dastur, Sonu Sood, Aarif Rahman, Miya Muqi, Zhang Yixing, Eric Tsang"
60033312,"United States, Australia",John Dahl,"Benjamin Bratt, James Franco, Connie Nielsen, Marton Csokas, Joseph Fiennes, Motoki Kobayashi, Robert Mammone, Natalie Mendoza, Cesar Montano, James Carpinello, Mark Consuelos, Sam Worthington, Craig McLachlan, Max Martini, Clayne Crawford"
80244539,,,"Sean Jindachot, Jintanutda Lummakanon, Charebelle Lanlalin, Aon Korakot Tunkaew, Attaporn Teemakorn, Rath Rattasin Nalintanapat, Ak Akarat, Geng Wayo Assawarungruang, Pemy Peramin Thabkaew"
81087762,South Korea,,"Park Bo-young, Ahn Hyo-seop, Lee Sung-jae, Lee Si-eon, Han So-hee, Kwon Soo-hyun, Kim Sa-rang, Ahn Se-ha, Yun Yoo-sun"
80106440,United States,John Carchietta,"Nichole Bloom, Fabianne Therese, Michelle Borth, Pat Healy, AJ Bowen, Joshua Leonard"
80220650,South Korea,,"Seungri, Yoo Byung Jae, Lee Jai-jin, Jinu, Son Se-bin, Kim Ga-eun, Park Choong-hwan, Baek Yeong-gwang, Choi Sin-deuk"
70109378,India,Sachin Kamlakar Khot,"Mallika Sherawat, Ranvir Shorey, Tinnu Anand, Sushmita Mukherjee, Manish Anand, Vihang Nayak, Bharati Achrekar, Zeenat Aman"
80002612,United States,,"Finn Jones, Jessica Henwick, David Wenham, Jessica Stroup, Tom Pelphrey"
80081337,United States,Chad Van De Keere,"Nathan Gamble, Ray Liotta, Emilio Estevez, Ariel Winter, Matthew Lillard, Yuri Lowenthal, Marion Ross, Tara Strong"
80184771,United States,,Bill Gates
81210770,Taiwan,Ding-Lin Wang,"Roy Chiu, Chia-Chia Peng, Wen Chen-ling, Eugenie Liu, Yeo Yann Yann"
80154638,South Korea,,"Su-jong Choi, Hee-Ra Ha, Jay Kim, Ji-hye Wang, Shin-il Kang"
80100937,United States,Macon Blair,"Melanie Lynskey, Elijah Wood, David Yow, Jane Levy, Devon Graye, Christine Woods, Robert Longstreet, Gary Anthony Williams"
80197989,United States,,"Kathryn Newton, Gideon Adlon, Sean Berdy, Natasha Liu Bordizzo, Jacques Colimon, Olivia DeJonge, Alex Fitzalan, Kristine Froseth, José Julián, Alex MacNicoll, Toby Wallace, Rachel Keller"
80119194,United States,William Wyler,
70202151,United States,Douglas McGrath,"Sarah Jessica Parker, Pierce Brosnan, Greg Kinnear, Christina Hendricks, Kelsey Grammer, Seth Meyers, Olivia Munn, Jane Curtin, Mark Blum, Busy Philipps, Sarah Shahi, Jessica Szohr"
70242897,United States,,"Alex Heartman, Najee De-Tiege, Hector David Jr., Erika Fong, Brittany Anne Pirtle, Steven Skyler, Rene Naufahu, Paul Schrier, Felix Ryan, Jeff Szusterman, Stig Alred, Kate Elliot"
80216677,,,Derren Brown
81034635,,Matt Askem,"Gary Lightbody, Nathan Connolly, Jonny Quinn, Paul Wilson, Johnny McDaid, Edith Bowman"
81163776,Thailand,,"Leo Putt, Pimchanok Luevisadpaibul, Suthada Jongjaiphar, Chatra Baude, Claudia Chakrapan, Oabnithi Wiwattanawarang, Varatta Vajrathon, Varot Makaduangkeo, Supasit Chinvinijkul"
80201680,United States,,"Michael Douglas, Alan Arkin, Sarah Baker, Nancy Travis, Susan Sullivan, Lisa Edelstein, Emily Osment, Graham Rogers, Jenna Lyng Adams, Ashleigh LaThrop, Melissa Tang, Casey Thomas Brown, Ann-Margret, Danny DeVito"
80127995,United States,Oliver Stone,Oliver Stone
80095532,United States,,"Justina Machado, Rita Moreno, Todd Grinnell, Isabella Gomez, Marcel Ruiz, Stephen Tobolowsky"
81116487,South Korea,,"Shin Sae-kyeong, Cha Eun-woo, Park Ki-woong, Lee Ji-hoon, Park Ji-hyun, Gong Jung-hwan, Kim Min-sang, Choi Duk-mun, Kim Yeo-jin"
80185032,United States,Katherine Fairfax Wright,Todrick Hall
80188579,"Mexico, Finland",Kyzza Terrazas,"Luis Gerardo Méndez, Brontis Jodorowsky, Joonas Saartamo, Laura Birn, Ilkka Koivula, Ville Virtanen, Raúl Villegas, Miriam Balderas, Ximena Guzmán"
80157866,United Kingdom,Sean Foley,"Julian Barratt, Andrea Riseborough, Essie Davis, Russell Tovey, Simon Farnaby, Steve Coogan, Richard McCabe, David Schofield, Nicholas Farrell, Jessica Barden"
81029831,Hong Kong,Vincent Kok,"Louis Koo, Sandra Ng Kwan Yue, Raymond Wong, Ronald Cheng, Yao Chen, Guo Tao, Heung Kam Lee, Chun Chau Ha, Miki Shum"
80209796,Canada,Mina Shum,"Cheng Pei-pei, Tzi Ma, Sandra Oh, Don McKellar, Zak Santiago, Liane Balaban, Alannah Ong, Lillian Lim, Jemmy Chen"
81044607,Malaysia,,"Steven Tan, Iain McNally, Chi-Ren Choong, Kevin Adrian Barnaby, Tikriti Shabudin, Sherilyn Pang Li Ching, Azman Zulkiply"
80223123,United States,Gregory Caruso,
70243692,"United Kingdom, Australia, Canada, United States",Stephen Hopkins,"David Morrissey, Eddie Marsan, Aidan Gillen, O. T. Fagbenle, Lorraine Ashbourne, Natascha McElhone, Sara Lloyd-Gregory, Aisling Loftus, Sarah Niles, Joshua Close, Brian McCardie"
80179201,United Kingdom,Gordon Anderson,"David Hasselhoff, Asim Chaudhry, Fergus Craig, Mark Quartley, Ella Smith, Brett Goldstein"
80179782,United States,,"Nat Faxon, Jay Gragnani, Ramone Hamilton, Sean Astin, Dayci Brookshire, Jorge Diaz, Evan Kishiyama"
80107219,India,Qaushiq Mukherjee,"Joyraj Bhattacharya, Rii, Soumyak Kanti DeBiswas, Anubrata Basu, Tillotama Shome, Maya Tideman, Tinu Verghese, Immaduddin Shah, Sayani Gupta"
80053653,United States,,"Willa Fitzgerald, Bex Taylor-Klaus, John Karna, Amadeus Serafini, Connor Weil, Carlson Young, Jason Wiles, Tracy Middendorf, Tom Maden, Bobby Campo, Santiago Segura, Mike Vaughn"
81172740,Nigeria,BB Sasore,"Chigul, Patrick Diabuah, Adetomiwa Edun, Uche Jumbo, Saidi Balogun, Ali Nuhu, Bimbo Manuel, Akah Nnani, Damilola Adegbite, Dorcas Shola Fapson"
81139317,Pakistan,,"Feroze Khan, Sana Javed, Mehmood Aslam, Saman Ansari, Qavi Khan, Salma Hasan, Rashid Farooqi, Muhammad Mubarik Ali"
80092415,Canada,,Cyril Chauquet
80184129,United States,Trent Haaga,"Matthew Gray Gubler, AnnaLynne McCord, Alisha Boe, Sheila Vand, Sam Eidson, James Moses Black, Ajay Mehta, Michael Beasley, David Maldonado, Hallie Grace Bradley, Peter Jaymes Jr., Eric Podnar, Lucy Faust"
80214743,United States,Scott Zabielski,Jim Jefferies
60024161,United States,David Raynr,Martin Lawrence
70143369,United States,Andrew Stanton,"Taylor Kitsch, Lynn Collins, Samantha Morton, Willem Dafoe, Thomas Haden Church, Mark Strong, Ciarán Hinds, Dominic West, James Purefoy, Bryan Cranston, Polly Walker, Daryl Sabara, Art Malik, Eileen Page, Amanda Clayton, Davood Ghadami, Daniel O'Meara, Jill Baker, Josh Daugherty, Oliver Boot, Philip Arditti, Arkie Reece, Joe Billingiere, Don Stark, Darwin Shaw, Figs Jackman, David Schwimmer, Emma Clifford, Christopher Goodman, Cate Fowler, Sean Carrigan, Dusty Sorg, Steven Cree, Phil Cheadle, Holly Weston, Nicholas Woodeson, Rupert Frazer, Edmund Kente"
81019031,India,Shaad Ali,"Diljit Dosanjh, Tapsee Pannu, Angad Bedi, Kulbhushan Kharbanda, Satish Kaushik, Vijay Raaz, Seema Kaushal, Mahabir Bhullar, Alka Badola Kaushal, Jimmy Moses"
80192098,Spain,,"Úrsula Corberó, Itziar Ituño, Álvaro Morte, Paco Tous, Enrique Arce, Pedro Alonso, María Pedraza, Alba Flores, Miguel Herrán, Jaime Lorente, Esther Acebo, Darko Peric, Kiti Mánver"
70251218,United States,Michael Mayer,
81172905,,Frank Rajah Arase,"Sam Dede, Bimbo Manuel, Okawa Shaznay, Shan George, Austin Enabulele, Precious Udoh"
1064058,,S.S. Wilson,"Fred Ward, Chris Gartin, Helen Shaver, Michael Gross, Marcelo Tubert, Marco Hernandez, José Ramón Rosario, Thomas Rosales Jr."
80209895,United States,Derek Peck,Ram Dass
81137482,"Denmark, Brazil, France, Portugal, Sweden","Petra Costa, Lea Glob","Olivia Corsini, Sergio Nicolai, Arman Saribekyan, Sylvain Jailloux, Francis Ressort, Pancho Garcia Aguirre, Shaghayegh Beheshti, Elena Bellei, Sébastien Brottet-Michel, Célia Catalifo"
80128096,,,
81075235,India,A.R. Murugadoss,"Vijay, Varalakshmi Sarathkumar, Keerthi Suresh, Radha Ravi, Pala Karuppaiah, Yogi Babu"
80230402,United States,Stan Lathan,Dave Chappelle
60034116,,Nagesh Kukunoor,"Naseeruddin Shah, Jackie Shroff, Juhi Chawla, Nagesh Kukunoor, Gulshan Grover, Aditya Lakhia, Shri Vallabh Vyas"
80153897,China,Liu Jie,"Wallace Huo, Qin Hailu, Regina Wan, Jessie Li, Dong Zijian, Li Yiqing, Fan Qianhui"
80191356,Canada,Vivieno Caldinelli,"Jonny Gray, Callan Potter, Peter Keleghan, Hannah Vandenbygaart, Kiana Madeira, Joshua Kilimnik, Drew Haytaoglu, Isiah Lea, Scott Thompson, Caroline Rhea"
80134527,United States,Joe Swanberg,"Jake Johnson, Aislinn Derbez, Joe Lo Truglio, Keegan-Michael Key, Nicky Excitement"
80025390,"Australia, United States",Russell Crowe,"Russell Crowe, Olga Kurylenko, Yılmaz Erdoğan, Cem Yılmaz, Jai Courtney, Ryan Corr, James Fraser, Ben O'Toole, Steve Bastoni, Salih Kalyon"
80161700,South Korea,,"L, So-hui Yoon, Gi-du Kim, Chang-hwan Kim, Ji Su, Tae-im Lee, Nam-gil Kang"
70042687,"United States, Germany",James Wong,"Mary Elizabeth Winstead, Ryan Merriman, Kris Lemche, Alexz Johnson, Sam Easton, Jesse Moss, Gina Holden, Texas Battle, Chelan Simmons, Crystal Lowe, Amanda Crew"
80160692,Philippines,Maryo J. De los Reyes,"Angelica Panganiban, Dingdong Dantes, Paulo Avelino, Maricar Reyes, Denise Laurel, Dimples Romana, Justin Cuyugan, Mart Escudero, Pamu Pamorada, Lei Andre Navarro, Irma Adlawan"
80106989,"Denmark, United Kingdom",Kasper Barfoed,"Ulrich Thomsen, Henning Jensen, Mikkel Boe Følsgaard, Cyron Melville, Esben Smed Jensen, Gustav Dyekjaer Giese, Jon Lange, Allan Hyde, Johannes Lassen, Morten Vang Simonsen"
80117557,United States,,"Michelle Monaghan, Mehdi Dehbi, John Ortiz, Tomer Sisley, Melinda Page Hamilton, Stefania LaVie Owen, Sayyid El Alami, Jane Adams, Wil Traval, Fares Landoulsi"
80167646,"Chile, France",Christopher Murray,"Michael Silva, Bastián Inostroza, Ana María Henríquez, Mauricio Pinto, Pedro Godoy, Hermelinda Cayo, Héctor Mella, Gonzalo Villalobos, Noelia Rubio"
81025309,United States,,"Brit Eaton, Scott Glaves"
80032473,India,Rohit Jugraj,"Gippy Grewal, Gurpreet Guggi, Zarine Khan"
80052612,"United Kingdom, France",Ben Palmer,"Lake Bell, Simon Pegg, Ophelia Lovibond, Olivia Williams, Rory Kinnear, Henry Lloyd-Hughes, Ken Stott, Sharon Horgan, Harriet Walter, Stephen Campbell Moore, Dean-Charles Chapman, Phoebe Waller-Bridge"
81045308,Argentina,,"Nicolás Van de Moortele, Letizia Denise Bloisi, María Dupláa, Ciro Herce, Milagros Molina, Jorge Pinarello, Casper Uncal, Jorge Luis Alonso"
80237903,,Manny Rodriguez,Gabriel Iglesias
80046193,United States,,"Maria Bamford, Fred Melamed, Mary Kay Place, Ed Begley Jr., Ana Gasteyer, Lennon Parham, Bridget Everett, Mo Collins, June Diane Raphael, Dean Cain, Ólafur Darri Ólafsson, Patton Oswalt, Keith Lucas, Kenny Lucas, Sarah Silverman, Mira Sorvino, Jon Cryer, Brandon Routh, Adam Pally, Tig Notaro, Andy Samberg, David Spade, Fred Armisen, Jason Mantzoukas, Jenny Slate, Judd Apatow, Judy Greer, Weird Al Yankovic"
70095135,"United States, United Kingdom, Australia",Alex Proyas,"Nicolas Cage, Chandler Canterbury, Rose Byrne, Lara Robinson, D.G. Maloney, Nadia Townsend, Alan Hopgood, Adrienne Pickering"
60032685,India,Prawal Raman,"Aftab Shivdasani, Antara Mali, Boman Irani, Isha Koppikar, Nana Patekar, Raghuvir Yadav, Rajpal Yadav, Revathy, Saif Ali Khan, Sameera Reddy, Sanjay Kapoor, Shilpa Shetty, Sohail Khan, Vivek Oberoi"
80107030,"Mexico, United States",Lydia Tenaglia,"Jeremiah Tower, Anthony Bourdain, Mario Batali, Ruth Reichl"
80084838,India,Ksshitij Chaudhary,"Arya Babbar, Samiksha Singh, Gurpreet Guggi, Binnu Dhillon, Jaswinder Bhalla, B.N. Sharma, Veena Malik, Sardar Sohi"
