show_id,country,director,cast
80141891,"Argentina, Spain","Gastón Duprat, Mariano Cohn","Oscar Martínez, Dady Brieva, Andrea Frigerio, Nora Navas, Manuel Vicente, Belén Chavanne, Marcelo D'Andrea, Gustavo Garzón"
80044888,Philippines,Mae Czarina Cruz,"Kathryn Bernardo, Daniel Padilla, Lorna Tolentino, Gabby Concepcion, Inigo Pascual"
70286809,France,,
70252898,"Canada, United States, France",,"Clé Bennett, Christian Potenza, Scott McCord, Rachel Wilson, Drew Nelson, Stephanie Anne Mills, Novie Edwards, Megan Fahlenbock, Brian Foud, Emilie-Claire Barlow, Phillip David Lewis, Katie Crown, Sarah Gadon, Peter Oldring, Kristin Fairlie, Dan Petronijevic, Adam Greydon Reid"
80127459,United States,Sean Hanish,"Jacki Weaver, Troian Bellisario, Stana Katic, Michelle Trachtenberg, Jess Weixler, Alfred Molina, Amy Smart, Tom Everett Scott, Kaia Gerber, Aimee Garcia, Kathy Baker, Peter Jason"
81110394,United Kingdom,Matt Kay,Hiyori Kon
81036535,Singapore,Sam Loh,"William Lawandi, Angeline Yap, Vivienne Tseng, Esther Goh, Alan Tan"
81010865,Philippines,Olivia M. Lamasan,"Piolo Pascual, Toni Gonzaga, Iza Calzado"
80156767,Argentina,"Leandro Mark, Nicolás Silbert","Nicolás Vázquez, Alan Sabbagh, Benjamín Amadeo, Eva De Dominici, César Bordón, Julian Kartun, Paula Carruega, Luciano Rossi, Ezequiel Campa"
80998562,,Jijo Pancode,"Tini Tom, Meghanathan, Balachandran Chullikadu, Shivaji Guruvayoor, Kottayam Purushan, Nithin George, Grace Antony, Shalu"
81074060,France,,"Ahmed Sylla, Alban Ivanov, Ornella Fleury, Natoo, Carlito, Mcfly, Djimo, Lola Dubini, Noom Diawara, Tania Dutel, Hakim Jemili, Jason Brokerss, Bérengère Krief, Thomas Vandenberghe, Monsieur Poulpe, Jhon Rachid, Audrey Pirault, Jeanfi Janssens, Fadily Camara, Laurie Peret, Issa Doumbia, Anne-Sophie Girard, Elhadj Gaye, Guillaume Bats"
81065784,Egypt,Khaled El Halafawy,"Ahmed Eid, Ayten Amer, Ahmed Fouad Selim, Mohsen Mansour"
80094964,Pakistan,Asim Raza,"Adeel Hussain, Mahira Khan, Sheheryar Munawar, Sonya Jehan, Bushra Ansari, Nimra Bucha, Arshad Mahmud, Jamal Shah"
80094387,South Korea,,"Song Il-gook, Han Chae-young, Kim Min-jong, Go Eun Han, Jung Hoon Lee, Nam Da-Reum, Yoo In-young"
80036427,United Kingdom,,Chris Packham
70286901,Russia,,"Alina Kukushkina, Boris Kutnevich, Giselle Nieto, Elsie Fisher"
80063599,Canada,,"Michela Luci, Jamie Watson, Anna Claire Bartlam, Dante Zee, Eric Peterson"
70134539,India,Kookie V. Gulati,"Vivek Oberoi, Aruna Shields, Nandana Sen, Niroo Singh, Sanjay Kapoor, Rajesh Khattar, Dalip Tahil, Mayur Puri, Manish Ananad"
81037898,"United Arab Emirates, United States, United Kingdom",Asri Bendacha,Asri Bendacha
80175913,Turkey,,"Tuba Büyüküstün, Ilker Aksum, Bülent Emin Yarar, İpek Bilgin, Müjde Uzman, Firat Çelik, Ayten Uncuoglu, Cihat Tamer"
81057249,India,Mansore,"Sruthi Hariharan, Sanchari Vijay, Sharanya, Balaji Manohar, Greeshma Sridhar, Harshil Koushik, Shaanthala, Gopalkrishna Deshpande"
80148920,Brazil,Marco Dutra,"Leonardo Sbaraglia, Carolina Dieckmann, Chino Darín, Alvaro Armand Ugon, Mirella Pascual, Roberto Suárez, Paula Cohen, Dylan Cortes, Priscila Bellora, Gabriela Freire, María Mendive"
80015280,Germany,Detlev Buck,"Lina Larissa Strahl, Lisa-Marie Koroll, Louis Held, Ruby O. Fee, Charly Hübner, Michael Maertens, Winnie Böwe, Fabian Buch, Max von der Groeben, Martin Seifert"
80201814,India,"Sumitra Bhave, Sunil Sukthankar","Kishore Kadam, Ashwini Giri, Kamal Desai, Devika Daftardar, Sunil Sukthankar, Shriram Ranade, Padmanabh Bind"
70201870,Japan,,"Hiroshi Kamiya, Harumi Sakurai, Kana Hanazawa, Eri Kitamura, Ryohei Kimura, Takahiro Mizushima, Shun Takagi, Fuko Saito, Yui Makino, Hiro Masuda, Michael Rivas, Eiichiro Tokumoto, Yumiko Kobayashi, Hiroki Touchi, Miyuki Sawashiro, Chie Matsuura, Kana Asumi, Emiri Kato"
80112077,Taiwan,,"Chris Wang, Serena Fang, Jack Lee, Amanda Chou, Yin Fu, Rabbit Yang, Meng-sheng Shen"
70136074,"France, United States",Daniel Stamm,"Patrick Fabian, Ashley Bell, Iris Bahr, Louis Herthum, Caleb Landry Jones, Tony Bentley, John Wright Jr., Shanna Forrestall, Justin Shafer, Carol Sutton"
80140955,United States,,"Merle Dandridge, Kim Hawthorne, Desiree Ross, Lamman Rucker, Tye White, Lynn Whitfield, Deborah Joy Winans, Keith David, Lovie Simone, Gregory Alan Williams, Oprah Winfrey"
80219019,India,Shreyas Talpade,"Sunny Deol, Bobby Deol, Shreyas Talpade, Sonali Kulkarni, Tripti Dimri, Samiksha Bhatnagar, Lovely Singh, Purnima Varma"
81121186,United States,Daniel McCabe,Jay O. Sanders
17687959,United States,Frank Coraci,"Adam Sandler, Kathy Bates, Henry Winkler, Fairuza Balk, Jerry Reed, Lawrence Gilliard Jr., Blake Clark, Peter Dante, Jonathan Loughran, Al Whiting"
80094723,Philippines,Wenn V. Deramas,"Vice Ganda, Coco Martin, James Reid, Nadine Lustre, Karla Estrada, Ryan Bang, Badjie Mortiz, Alonzo Muhlach, Marco Masa, Lassy Marquez, MC Calaquian"
80201809,India,Sachin,"Bhargavi Chirmuley, Mahesh Kothare, Sachin, Ashok Saraf, Nirmiti Sawant"
81015153,Malaysia,Nam Ron,"Zahiril Adzim, Ario Bayu, Asmara Abigail, Rosdeen Suboh, Amerul Affendi, Iedil Putra, Timothy Castillo, Chew Kin Wah, Along Eyzendy, Nam Ron"
80999983,Thailand,Poj Arnon,"Kohtee Aramboy, Yingsak Chonglertjetsadawong, Jaturong Mokjok, Waraphat Phatsathit, Wiradit Srimalai, Ekkachai Srivichai, Varuth Waratham, Butsarin Yokpraipan"
70235768,Canada,Bruce McDonald,"Matthew Knight, Vanessa Morgan, Atticus Mitchell, Cameron Kennedy, Kate Todd, Joe Dinicol, Ella Jonas Farlinger, Ari Cohen, Laura de Carteret, Hrant Alianak"
80996791,United States,,"Dylan Minnette, Katherine Langford, Kate Walsh, Derek Luke, Alisha Boe, Justin Prentice, Brandon Flynn, Miles Heizer, Christian Navarro, Brian Yorkey, Tom McCarthy, Selena Gomez, Mandy Teefey, Jay Asher, Dr. Rona Hu, Dr. Helen Hsu, Dr. Rebecca Hedrick, Alexis Jones, Elaine Welteroth, Julia Bicknell, Dr. Christine Moutier, Nic Sheff, Carrie Goldberg, Anne Winters, Joy Gorman, Brandon Butler, Marissa Jo Cerar, Susanne Timms"
81020577,,,"Wu Kang-jen, Ivy Shao, Ben Wu, Xiao Man, Nylon Chen"
80033772,United States,"Kip Andersen, Keegan Kuhn",Kip Andersen
80222256,United States,Jenée LaMarque,"Jenée LaMarque, Angela Trimbur, Constance Wu, Josh Fadem, Ever Mainard"
80245117,United States,,
81018295,,,"Marina Inoue, Ryoko Shiraishi, Takuma Terashima, Junko Takeuchi, Fumihiro Okabayashi, Yu Kobayashi, Ayahi Takagaki"
80994421,India,Saheed Arafath,"Pranav Ratheesh, Maria Yohannan, Askar Ameer, Tini Tom, Anjali Nair, Krishna Prabha, Sudhi Koppa, Nandhan Unni"
80190180,"Bulgaria, United States","Paul Solet, Rick Benattar","Adrien Brody, John Malkovich, Rory Culkin, Antonio Banderas, Ori Pfeffer, Alexandra Dinu, Owen Davis, Deyan Petrov"
70117322,France,Pierre Morel,"John Travolta, Jonathan Rhys Meyers, Kasia Smutniak, Richard Durden, Bing Yin, Amber Rose Revah, Eric Godon, François Bredon, Chems Dahmani, Sami Darr, Didier Constant"
60020745,United States,Dominic Sena,"John Travolta, Hugh Jackman, Halle Berry, Don Cheadle, Sam Shepard, Vinnie Jones, Drea de Matteo, Rudolf Martin, Zach Grenier, Camryn Grimes"
80993095,India,Sachin Yardi,"Abhay Deol, Mithila Palkar, Vijay Raaz"
81104634,United States,Rhys Thomas,"John Mulaney, Alexander Bello, Tyler Bourke, Ava Briglia, Cordelia Comando, Camille De La Cruz, Oriah Elgrabli, Jake Ryan Flynn, Orson Hong, Isabella Iannelli, Jacob Laval, Suri Marrero, Zell Steele Morrow, Jonah Mussolino, Lexi Perkel, Linder Sutton"
80216302,United States,Chris Robinson,"Khalil Everage, Anthony Anderson, Uzo Aduba, Emayatzy Corinealdi, Paul Walter Hauser, Dave East, Seandrea Sledge, Ashley Jackson, Megan Sousa"
70124562,"United Kingdom, Canada",Sam Taylor-Johnson,"Aaron Taylor-Johnson, Anne-Marie Duff, Kristin Scott Thomas, David Threlfall, Thomas Brodie-Sangster, David Morrissey, Sam Bell, Ophelia Lovibond, Josh Bolt, Andrew Buchan"
70304256,Japan,,"Rikiya Koyama, Ayako Kawasumi, Sayaka Ohara, Sho Hayami, Tomokazu Seki, Jouji Nakata, Akina Abe, Takumi Yamasaki, Hikaru Midorikawa, Daisuke Namikawa"
60000440,United States,Paul Thomas Anderson,"Jeremy Blackman, Tom Cruise, Melinda Dillon, April Grace, Luis Guzmán, Philip Baker Hall, Philip Seymour Hoffman, Ricky Jay, William H. Macy, Alfred Molina, Julianne Moore, Michael Murphy, John C. Reilly, Jason Robards, Melora Walters"
80112518,"United Kingdom, France, Belgium",Ken Loach,"Dave Johns, Hayley Squires, Briana Shann, Dylan McKiernan, Kate Rutter, Sharon Percy, Kema Sikazwe, Steven Richens"
80016471,United States,Glenn Miller,"Nicola Lambo, Evan Boymel, John P. Fowler, Erica Duke, Ezra James Colbert"
80128722,United States,Mike Flanagan,"Carla Gugino, Bruce Greenwood, Henry Thomas, Carel Struycken, Chiara Aurelia"
28631029,"Germany, United States",Rob Minkoff,"Michael J. Fox, Jonathan Lipnicki, Geena Davis, Hugh Laurie, Nathan Lane"
80170720,Mexico,,"Alfonso Herrera, Damián Alcázar, Gabriela Roel, Itahisa Machado, Dagoberto Gama, Hernán Mendoza, Daniel Martínez, Christian Vasquez, Aleyda Gallardo, Danny Perea, Pakey Vázquez, Fátima Molina, Héctor Holten, Carlos Valencia"
80180601,Malaysia,,"Amyra Rosli, Fadlan Hazim, Maria Farida, Sharifah Haslinda, Syafiq Kyle, Sasqia Dahuri, Raja Ema, Faye Kusairi, Puteri Octovia, Roy Azman, Norlia Ghani"
80178427,South Korea,,"Kim Sang-jung, Ma Dong-seok, Park Hae-Jin, Cho Dong-hyuk, Kang Ye-won, Kang Shin-il, Ji-a Min, Hwang Seung-eon"
80187435,United States,Jay Chapman,Craig Ferguson
80141960,United Kingdom,,"Georgina Campbell, Joe Dempsie, Adrian Edmondson, Steve Evets, Laura Fraser, Julie Graham, John Lynch, Gary Lewis, Juliet Stevenson, Joanna Vanderham"
70058022,United States,Akiva Schaffer,"Andy Samberg, Jorma Taccone, Bill Hader, Danny McBride, Isla Fisher, Sissy Spacek, Ian McShane, Will Arnett, Chris Parnell, Chester Tam"
81000505,Japan,"Akiyuki Shinbo, Nobuyuki Takeuchi","Yuki Kaji, Nobuo Tobita, Michiko Neya, Mitsuru Miyamoto, Fumihiko Tachiki, Shintaro Asanuma, Takahiro Sakurai, Kana Hanazawa, Toshiyuki Toyonaga, Suzu Hirose, Shinichiro Miki, Mamoru Miyano, Takako Matsu, Masaki Suda"
81014647,Australia,,"Jane Turner, Gina Riley, Glenn Robbins, Peter Rowsthorn, Magda Szubanski"
70268449,"United Kingdom, Egypt, United States",Jehane Noujaim,"Ahmed Hassan, Khalid Abdalla, Magdy Ashour, Ramy Essam, Bothaina Kamel, Dina Abdullah, Aida Elkashef, Ragia Omran, Pierre Seyoufr, Dina Amer, Sherif Boray, Khaled Nagy, Salma Saied, Ahmed Saleh, Alaa Seif"
80994020,Argentina,Sebastián Schindel,"Joaquín Furriel, Martina Gusmán, Luciano Cáceres, Heidi Toini, Regina Lamm"
70301469,United States,Jay Chapman,Jim Gaffigan
81227195,South Africa,Mandla Dube,"Thabo Rametsi, Thabo Malema, Welile Nzuza, Jafta Mamabolo, Louw Venter, Pearl Thusi"
70302573,Japan,,"Yoshitsugu Matsuoka, Haruka Tomatsu, Ayana Taketatsu, Kanae Ito, Rina Hidaka, Ayahi Takagaki, Hiroaki Hirata, Hiroki Yasumoto, Saori Hayami, Koichi Yamadera"
81045513,United States,,Sam Kinison
70254351,India,Prakash Jha,"Kareena Kapoor, Amitabh Bachchan, Ajay Devgn, Arjun Rampal, Amrita Rao, Manoj Bajpayee, Vipin Sharma, Anjali Patil"
80022605,"Canada, Mexico, Germany, South Africa",Atom Egoyan,"Christopher Plummer, Bruno Ganz, Jürgen Prochnow, Heinz Lieven, Henry Czerny, Dean Norris, Martin Landau"
81035862,Egypt,Mohamed Samy,"Tamer Hosny, Mai Ezzidine, Ezzat Abou Aouf, Lamitta Frangieh"
80238299,India,Aatmaram Dharne,Nagesh Bhonsle
80173269,United States,Drew Stone,Michael Alago
80172475,United Kingdom,,"Liz Bonnin, Jon Gupta, Freida Pinto"
80156369,Australia,John Duigan,"Judy Davis, Bryan Brown, Cathy Downes, Baz Luhrmann, Peter Mochrie, Mervyn Drake, Margie McCrae"
81030976,,Víctor García,"Claire Forlani, Jake Abel, Titus Welliver, Melina Matthews"
80001101,United States,,Michael Izquierdo
80035480,United Kingdom,,"Natalia Tena, Iwan Rheon, Jamie Draven, Danny Webb, Franz Drameh, Adrian Schiller, Eleanor Matsuura, Brian Ferguson, Emilia Jones, Tom Goodman-Hill"
80155475,"United Kingdom, France, Belgium, United States",Fabrice Du Welz,"Chadwick Boseman, Luke Evans, Teresa Palmer, Alfred Molina, Natalie Martinez, Tom Felton, Dale Dickey, Sibongile Mlambo"
80221210,Brazil,,"Naruna Costa, Seu Jorge, Hermila Guedes, Lee Taylor, Danilo Grangheia, Wesley Guimarães, Pedro Wagner"
80168161,United States,Patrick Brice,"Mark Duplass, Desiree Akhavan, Karan Soni"
70283261,United States,,"Joseph Morgan, Daniel Gillies, Phoebe Tonkin, Charles Michael Davis, Leah Pipes, Danielle Campbell, Claire Holt, Steven Krueger"
70059191,Hong Kong,Chia-Liang Liu,"Gordon Liu, Chia Yung Liu, Hou Hsiao, Chia-Liang Liu, Tiet Wo Chu, Sheng Fu, Kara Hui"
81217737,India,Arjun Jandyala,"Adithya Menon, Kartikeya Gummakonda, Anagha LK"
81088283,"Ireland, United States, France",Gerry Hoban,Hugh Bonneville
80994222,United States,,"Jeff Ross, Bob Saget, James Adomian, Rachel Feinstein, Jerry Minor, Ayden Mayeri, Jaleel White, Natasha Leggero, Yamaneika Saunders, John Stamos, Nikki Glaser, Seth Green, Fortune Feimster, Jon Lovitz, Mindy Rickles, Gilbert Gottfried, Sasheer Zamata, Brandon T. Jackson, Ryan Phillippe, Ken Marino, Bridget Everett, John Gemberling, Leonardo Nam, Josh Homme"
80208906,United States,Archie Borders,"Matt Walsh, Judith Godreche, Reid Scott, Michaela Watkins, David Wain, Gary Cole"
80217733,Japan,Shinsuke Sato,"Sota Fukushi, Hana Sugisaki, Ryo Yoshizawa, Erina Mano, Yu Koyanagi, Seiichi Tanabe, Taichi Saotome, Miyavi, Masami Nagasawa, Yosuke Eguchi"
70056686,India,Saket Chaudhary,"Rahul Bose, Mallika Sherawat, Ranvir Shorey, Sharat Saxena, Aamir Bashir, Taraana Raja, Jas Arora, Suchitra Pillai, Sapna Bhavnani, Sophiya Chaudhary"
80167644,"United States, Iceland","Geoffrey Orthwein, Andrew Sullivan","Maika Monroe, Matt O'Leary, Arnar Jónsson, Gunnar Helgason, Berglind Rós Sigurðardóttir"
80993106,,,"Thanabordee Jaiyen, Emika Grant Emma, Tantimedh Chisanusha, Siribanchawan Jidapa, Supanut Sudjinda"
80996626,,,"Michela Luci, Jamie Watson, Anna Claire Bartlam, Dante Zee, Eric Peterson"
80180544,,,
80108610,"Netherlands, Denmark, France, Germany",Andreas Johnsen,
80993489,United States,"Jesse Handsher, Olivier Roland","Mark Schneider, Frank Samson"
80179900,United States,,Lucy Hale
80032472,India,Manjeet Maan,"Gurdas Maan, Neeru Bajwa, Jassi Gill, Rajiv Thakur, Khushdeed Maan, Manav Vij, Raj Jhinger, Shruti Sodhi, Meher Vij"
70060000,United States,Neil Jordan,"Jodie Foster, Terrence Howard, Naveen Andrews, Carmen Ejogo, Nicky Katt, Mary Steenburgen, Lenny Venito, Zoë Kravitz, Jane Adams, Gordon MacDonald"
80165295,South Korea,,"Im Si-wan, Kang So-ra, Lee Sung-min, Kang Ha-neul, Byun Yo-han, Kim Dae-myeong, Shin Eun-jung, Park Hae-joon"
80213115,Spain,Elías León,
81030201,Hong Kong,Lawrence Cheng,"Ekin Cheng, Chrissie Chow, Ivana Wong, Jase Ho, Alex Lam, Wen Xin, Miriam Chin Wah Yeung, Eric Kot, Kar Lok Chin"
81152923,United States,J.M. Berrios,"Scott Pryor, Darrin Dewitt Henson, Eric Roberts, Kevin Sizemore, Lorynn York, John Gray, Sara McMann, Ovince Saint Preux"
80165072,United Kingdom,,Donal MacIntyre
81016321,Indonesia,Angga Dwimas Sasongko,"Tio Pakusadewo, Julie Estelle, Widyawati, Rio Dewanto, Chicco Jerikho, Jajang C. Noer, Shafira Umm"
80116307,South Korea,John H. Lee,"Jung-jae Lee, Beom-su Lee, Liam Neeson, Se-yeon Jin, Jun-ho Jeong, Cheol-min Park"
80189829,Turkey,,"Çağatay Ulusoy, Ayça Ayşin Turan, Hazar Ergüçlü, Okan Yalabık, Mehmet Kurtuluş, Yurdaer Okur"
1067876,United States,Henry Hathaway,"John Wayne, Glen Campbell, Kim Darby, Jeremy Slate, Robert Duvall, Dennis Hopper, Alfred Ryder, Strother Martin, Jeff Corey"
80189954,Canada,Robert Vince,"Kaitlyn Maher, Obba Babatundé, Lombardo Boyar, Molly Burnett, Chris Coppola, Reggie De Leon, David DeLuise, Matty Finochio, Josh Flitter, Benjamin Flores Jr."
80147919,Canada,,"Adrian Petriw, Ashleigh Ball, Connor Parnall, Mark Hildreth, Alex Barima, Jesse Moss, Diana Kaarina, Brian Dobson"
81063160,Canada,,
70100383,"United States, United Kingdom",Sam Mendes,"Leonardo DiCaprio, Kate Winslet, Kathy Bates, Michael Shannon, Kathryn Hahn, David Harbour, Dylan Baker, Richard Easton, Zoe Kazan, Jay O. Sanders, Max Casella"
80108234,Hong Kong,Philip Yung,"Irene Wan, Peter Mak, Rainky Wai, Heidi Lee, Kabby Hui, Paulyn Sun, Dominic Ho, Au Cheuk-Man"
80029368,United States,Bill D'Elia,Chris D'Elia
60020948,United States,"Charles A. Nichols, Iwao Takamoto","Debbie Reynolds, Charles Nelson Reilly, Paul Lynde, Henry Gibson, Rex Allen, Danny Bonaduce, Pamelyn Ferdin, Don Messick, Agnes Moorehead, Martha Scott, John Stephenson, Herb Vigran, Dave Madden"
80095531,India,Mozez Singh,"Vicky Kaushal, Sarah-Jane Dias, Raaghav Chanana, Manish Chaudhary, Meghna Malik, Malkeet Rauni, Anita Shabdish, Chittaranjan Tripathy"
81024703,,Shagufta Rafique,"Kartar Cheema, Jashan Singh, Sakshi Gulati, Gulshan Grover, Savita Bhatti, Yashpal Sharma, Mohit Sharma, Sukhwinder Sohi"
80134518,Turkey,Meltem Bozoflu,"Onur Buldu, Alper Kul, Erdem Yener, Onur Atilla, Özge Borak, Doğa Rutkay, Meltem Yılmazkaya, İrem Sak"
80077402,United States,Chris Sparling,"James Wolk, Caitlin Fitzgerald, Tom Lipinski, Dan Ziskie, Michael Godere, Michael Donovan, Dion Graham, Constance Barron"
80201604,India,,"Makarand Anaspure, Madhura Velankar, Subodh Bhave"
81152930,United States,Blayne Weaver,"Barry Bostwick, Jennifer Stone, Devon Werkheiser, McKayla Witt, Joshua Cody, Hank Stone"
70114589,India,Prem Soni,"Salman Khan, Kareena Kapoor, Sohail Khan, Preity Zinta, Bappi Lahiri, Yash Tonk, Nauheed Cyrusi, Mahek Chahal"
80170109,Chile,,"Iván Álvarez de Araya, Blanca Lewin, Karla Melo, Sebastián Ayala, Roberto Farías, Sergio Hernández"
70052249,India,"Priyadarshan, Kookie V. Gulati","Shahid Kapoor, Kareena Kapoor, Om Puri, Neha Dhupia, Sunil Shetty, Paresh Rawal, Rajpal Yadav, Shakti Kapoor"
70270775,"Hong Kong, China",Wong Kar Wai,"Tony Leung Chiu-wai, Zhang Ziyi, Chang Chen, Xiao Shen-Yang, Zhao Benshan, Song Hye-kyo, Wang Qingxiang, Zhang Jin, Lo Hoi-pang, Cung Le, Julian Cheung"
60021525,India,Farhan Akhtar,"Aamir Khan, Saif Ali Khan, Akshaye Khanna, Preity Zinta, Sonali Kulkarni, Dimple Kapadia, Ayub Khan, Rajat Kapoor, Suhasini Mulay, Ahmed Khan"
80242720,,,"Diego Capusotto, Ivana Acosta"
81002145,"United States, Mexico",,"Omar Chaparro, Anna Ruiz"
80104237,Argentina,Daniel Burman,"Alan Sabbagh, Julieta Zylberberg, Usher Barilka, Elvira Onetto, Adrián Stoppelman, Dan Breitman, Elisa Carricajo"
80198419,France,Teddy Lussi-Modeste,"Tahar Rahim, Maïwenn Le Besco, Roschdy Zem, Grégoire Colin, Sultan, Ali Marhyar, Camille Lellouche, Saïda Bekkouche, Meriem Serbah, Salma Lahmer"
80092925,Philippines,Cathy Garcia-Molina,"John Lloyd Cruz, Bea Alonzo, Dimples Romana, Janus del Prado, James Blanco, Ahron Villena, Beatriz Saw, Shamaine Centenera, Khalil Ramos, Billy Crawford, Al Tantay, Arci Muñoz"
81026453,United States,,Hunter March
70236016,United States,Peter Howitt,"Debby Ryan, Sarena Parmar, Adam DiMarco, Merritt Patterson, Nancy Robertson"
60020826,"Germany, Canada, United States",Frank Oz,"Robert De Niro, Edward Norton, Marlon Brando, Angela Bassett, Gary Farmer, Paul Soles, Jamie Harrold, Serge Houde"
81193616,United States,,Scott Kelly
786137,United States,Howard Zieff,"Dan Aykroyd, Jamie Lee Curtis, Macaulay Culkin, Anna Chlumsky, Richard Masur, Griffin Dunne, Ann Nelson, Peter Michael Goetz, Jane Hallaren, Anthony R. Jones"
70204282,"Venezuela, Colombia",Jorge Granier,
684847,United States,Tony Scott,"Bruce Willis, Damon Wayans, Chelsea Field, Noble Willingham, Taylor Negron, Danielle Harris, Halle Berry, Bruce McGill"
81121175,United States,Sarah Holt,Craig Sechler
70301279,United States,Malik Vitthal,"John Boyega, Rotimi, Glenn Plummer, De'Aundre Bonds, Keke Palmer, Nora Zehetner, Todd Louiso"
70197459,"United States, Canada",Ezekiel Norton,"Diana Kaarina, Morwenna Banks, Nicole Oliver, Brittney Wilson, Ali Liebert, Shannon Chan-Kent, Madeleine Peters, Cathy Weseluck, Ellen Kennedy, Vincent Tong, Derek Waters, Brian Drummond, Tabitha St. Germain, Bethany Brown, Miranda Nolte, Kelly Metzger, Kazumi Evans, Anna Cummer"
80998566,India,Sabu Varghese,"Udhay, Kiran Raj, I.M. Vijayan, Sandhanam, Shivani Bhai, Sangeetha Balan"
81121183,United States,Oliver Twinch,Craig Sechler
70044594,"United States, Australia",Mark Steven Johnson,"Nicolas Cage, Eva Mendes, Wes Bentley, Sam Elliott, Donal Logue, Matt Long, Peter Fonda, Brett Cullen, Raquel Alessi, Laurence Breuls"
80240024,,,"Wanida Termthanaporn, Apinya Sakuljaroensuk, Golf Pichaya Nitipaisankul, Thassapak Hsu"
80180225,"Portugal, France, Poland, United States",Gabe Klinger,"Anton Yelchin, Lucie Lucas, Françoise Lebrun, Paulo Calatré"
1151721,United States,Mike Newell,"Al Pacino, Johnny Depp, Michael Madsen, Bruno Kirby, James Russo, Anne Heche, Zeljko Ivanek, Gerry Becker, Robert Miano, Zach Grenier"
80168033,"United Kingdom, United States",Barney Clay,Mick Rock
80201933,United States,,
81013509,Mexico,Enrique García Meza,
70283260,United States,,"Adelaide Kane, Megan Follows, Torrance Coombs, Toby Regbo, Jenessa Grant, Celina Sinden, Caitlin Stasey, Anna Popplewell, Alan Van Sprang, Rossif Sutherland, Jonathan Keltz, Sean Teale, Craig Parker"
81168348,Poland,Janusz Majewski,"Mariusz Dmochowski, Ewa Krzyżewska, Włodzimierz Boruński, Andrzej Mrowiec, Józef Rosiński, Piotr Kąkolewski, Beata Nowicka, Edmund Fetting, Grażyna Staniszewska, Andrzej Łapicki"
70040912,India,David Dhawan,"Salman Khan, Sushmita Sen, Sohail Khan, Katrina Kaif, Arshad Warsi, Isha Koppikar, Rajpal Yadav, Beena Kak"
80191963,"United Kingdom, India, United States",Kavi Raz,"Satinder Sartaaj, Shabana Azmi, Jason Flemyng, Amanda Root, Rup Magon, Sophie Stevens, Keith Duffy, David Essex, Leanne Joyce, Ranjit Singh Shubh"
81035848,Egypt,Hadi El Bagoury,"Hani Salama, Basma Ahmad, Rania Yousef, Kinda Allouch, Yasmin Raeis, Amr Youssef, Zizi El-Badrawy"
80202352,"Serbia, United States",Eric Zaragosa,"Scott Adkins, Aaron McCusker, Vahldin Prelic, Lukas Loughran, Michelle Lehane, Alaa Seif, Milan Kovacevic, Arkie Reece, Vladimir Alenikov, Dominic Power"
80048100,France,,"Fanny Bloc, Jules De Jongh, Patrick Béthune, Hugo Chandor, Adeline Chetail, Jessica Bell, Thomas Guitard, Ross Grant, Geneviève Doang"
80156763,"France, Belgium",Lucien Jean-Baptiste,"Lucien Jean-Baptiste, Aissa Maiga, Zabou Breitman, Vincent Elbaz, Michel Jonasz, Naidra Ayadi, Marie-Philomène Nga, Bass Dhem, Delphine Théodore"
80169548,"United States, Australia, Samoa, United Kingdom",Sarah Moshman,
81057246,India,Suseenthiran,"Roshan, Priyaa Lal, Aadukalam Naren, Singam Puli, Meera Krishnan, Jayaprakash"
81047897,Indonesia,Hanung Bramantyo,"Fedi Nuril, Rianti Cartwright, Carissa Putri, Melanie Putria, Zaskia Adya Mecca, Surya Saputra, Dennis Adhiswara, Oka Antara"
70285581,United States,,"Caitriona Balfe, Sam Heughan, Tobias Menzies, Gary Lewis, Graham McTavish, Lotte Verbeek, Duncan Lacroix, Laura Donnelly, Bill Paterson, Stephen Walters, Grant O'Rourke, Simon Callow, Richard Rankin, Sophie Skelton, David Berry, Romann Berrux, Ed Speleers, Maria Doyle Kennedy, Tim Downie"
70136152,United States,,"Andy Whitfield, Liam McIntyre, Dustin Clare, John Hannah, Manu Bennett, Lucy Lawless, Peter Mensah, Nick E. Tarabay, Viva Bianca, Lesley-Ann Brandt, Jai Courtney, Daniel Feuerriegel"
80108158,United Kingdom,Vadim Jean,"Kelsey Grammer, Tamsin Greig, John Michael Higgins, Mathew Horne, Pearce Quigley, Togo Igawa, Sonya Cassidy, Julie Dray, Danny Morgan, Andrew Sachs"
81092768,Romania,Cristina Jacob,"Flavia Hojda, Crina Semciuc, Olimpia Melinte, Levent Sali, Vlad Logigan, Alex Calin, Alina Chivulescu, Razvan Vasilescu"
81071666,United States,,Will Smith
80226234,South Korea,Yang Woo-seok,"Woo-sung Jung, Do-won Kwak, Kap-soo Kim, Woo-jin Jo, Eui-sung Kim, Kyeong-yeong Lee, Won-joong Jung, Hyun-sung Jang"
80119234,United States,David Ayer,"Will Smith, Joel Edgerton, Noomi Rapace, Lucy Fry, Edgar Ramírez, Ike Barinholtz, Brad William Henke, Enrique Murciano, Happy Anderson, Kenneth Choi, Andrea Navedo, Dawn Olivieri"
80151663,United Kingdom,Mat Whitecross,"Oasis, Alan McGee, Paul McGuigan, Liam Gallagher, Noel Gallagher"
80134431,United States,Julius Onah,"Gugu Mbatha-Raw, David Oyelowo, Daniel Brühl, John Ortiz, Chris O'Dowd, Aksel Hennie, Zhang Ziyi, Elizabeth Debicki, Roger Davies, Clover Nee"
80025678,"United Kingdom, United States",,"Claire Foy, John Lithgow, Matt Smith, Vanessa Kirby, Jared Harris, Victoria Hamilton, Eileen Atkins, Jeremy Northam, Alex Jennings, Ben Miles, Pip Torrens, Will Keen, Harry Hadden-Paton, Daniel Ings, Greg Wise, Harriet Walter, Lia Williams, Matthew Goode, Anton Lesser"
81059656,United Kingdom,Emma Hatherley,Michael Mosley
81121181,United States,"Paula Apsell, Kirk Wolfinger",
60024962,United Kingdom,Nick Broomfield,Nick Broomfield
70213083,United States,,"Jason Smith, Aljin Abella, Anna Hutchison, David de Lautour, Nikolai Nikolaeff, Sarah Thomson, Bede Skinner, Holly Shanahan, Kelson Henderson, Richard Simpson, Cameron Rhodes, Elisabeth Easther, Mark Wright, Derek Judge"
70219528,India,Raj Kumar Gupta,"Emraan Hashmi, Vidya Balan, Rajesh Sharma, Namit Das, Parvin Dabas"
81004321,Brazil,Diego Pignataro,Whindersson Nunes
80005738,United Kingdom,"Max Lang, Jani Lachauer","Simon Pegg, Gillian Anderson, Rob Brydon, Martin Clunes, Sally Hawkins, David Walliams, Timothy Spall"
80155477,United States,Brent Bonacorso,"Bella Thorne, Halston Sage, Taylor John Smith, Nash Grier, Anna Akana, Kathryn Morris, Brigid Brannagh, Kimberly Williams-Paisley, Tyler Hanson"
80176929,South Korea,"Jung-ah Im, Seung-uk Jo","Hyun-moo Jun, Si-kyung Sung, Se-yoon Yoo"
80119186,United States,John Ford,
80108371,United States,Troy Miller,Cedric the Entertainer
80175332,Philippines,Cathy Garcia-Molina,"Liza Soberano, Enrique Gil, Joey Marquez, Cai Cortez, Arlene Muchlach, Ara Mina, Ryan Bang, Joross Gamboa, Jeffrey Tam, Neils Coleta"
80232892,"Argentina, France",Pablo Giorgelli,"Mora Arenillas, Mara Bestelli, Diego Cremonesi"
