show_id,country,director,cast
70121008,United States,Steve Rash,"Nestor Aaron Absera, Julianna Guill, Preston Jones, Julia Levy-Boeken, Danny Pudi, Michael Trotter, Daniel Newman, DJ Qualls"
81150918,,Camille Shooshani,"Léa Moret, Camille Shooshani"
80244992,India,,"Ramanathan, Rakesh"
80195429,United States,Michael McKay,Harith Iskander
80224536,United States,Steve Brill,Adam Sandler
80138030,Finland,,"Antti Pääkkönen, Heljä Heikkinen, Lynne Guaglione, Pasi Ruohonen, Rauno Ahonen"
80211703,Sweden,,"Hanna Ardéhn, Felix Sandman, William Spetz, Ella Rappich, David Dencik, Reuben Sallmander, Maria Sundbom, Rebecka Hemse, Arvid Sand, Helena af Sandeberg, Anna Björk"
80178974,United States,David E. Talbert,"Jessica Alba, Tim Allen, Dax Shepard, Vincent D'Onofrio, Luke Grimes, Kurtwood Smith, Michelle Mylett"
80131281,,,"Karol Modzelewski, Łukasz ""Lotek” Lodkowski"
80147758,Hungary,Attila Till,"Szabolcs Thuróczy, Zoltán Fenyvesi, Adám Fekete, Dusan Vitanovic, Mónika Balsai, Lidia Danis, Zoltán Mucsi"
5670479,"United States, Germany, Mexico",Martin Campbell,"Antonio Banderas, Anthony Hopkins, Catherine Zeta-Jones, Stuart Wilson, Matt Letscher, Tony Amendola, Pedro Armendáriz Jr., William Marquez, José Pérez, Victor Rivers"
80217569,United States,Federico D'Alessandro,"Maika Monroe, Ed Skrein, Gary Oldman"
80217627,United Kingdom,,
542137,United States,"Vincente Minnelli, Charles Walters","Leslie Caron, Maurice Chevalier, Louis Jourdan, Hermione Gingold, Eva Gabor, Jacques Bergerac, Isabel Jeans, John Abbott, Edwin Jerome, Corinne Marchand"
70213081,"United States, France, Japan",,"Archie Kao, Reggie Rolle, Danny Slavin, Valerie Vernon, Cerina Vincent, Russell Lawrence, Amy Miller, Melody Perkins, Kazuki Maehara, Eri Tanaka, Terence J. Rotolo, Hiroshi Tsuchida, Tom Whyte, Bob Papenbrook, Mari Maruta"
80124728,Mexico,"Raúl Campos, Jan Suter","Ricardo O'Farrill, Carlos Ballarta, Sofía Niño de Rivera, Chumel Torres, Marissa ""Chabe"" Lozano"
81024728,India,,"Amit Sial, Yoshika Verma, Anshuman Jha, Asif Basra, Suruchi Aulakh"
70114342,United States,"Albert Hughes, Allen Hughes","Denzel Washington, Gary Oldman, Mila Kunis, Ray Stevenson, Jennifer Beals, Evan Jones, Joe Pingue, Frances de la Tour, Michael Gambon, Tom Waits"
80154508,South Korea,,"Sung-yeol Lee, Ji-hyun Nam, Clara Lee, Jin Won"
81142595,,,"Andrew Gregson, Khemanit Jamikorn, Nattarat Nopparattayaporn, Pat Chatborirak, Nuttanan Kunnawat, Piyawatt Nivatvongs, Chalad Na Songkhla, Saranyoo Prachakit, Thanongsak Supasap, Supasit Chinvinijkul, Phuksanunt Tanamahataweekit"
80225085,United States,,"Tyler Posey, Charlet Chung, Jorge Diaz, Camille Ramsey, Luke Youngblood, Renée Elise Goldsberry"
70273637,India,Neeraj Pandey,"Akshay Kumar, Manoj Bajpayee, Anupam Kher, Jimmy Shergill, Kajal Aggarwal, Divya Dutta, Kharaj Mukherjee, Rajesh Sharma, Kishor Kadam, Neeru Bajwa, Deepraj Rana, Neetu Singh"
70213466,"United States, Mexico",Matt Piedmont,"Will Ferrell, Gael García Bernal, Diego Luna, Genesis Rodriguez, Pedro Armendáriz Jr., Nick Offerman, Efren Ramirez, Adrian Martinez"
80158388,India,Alo Sarkar,"Uttam Kumar, Sulakshana Pandit, Utpal Dutt, Bindu, Amjad Khan, Helen, Indrani Mukherjee, Padma Khanna, Iftekhar"
81023023,New Zealand,,
80236470,United Kingdom,"Roger Graef, James Rogan","John Cleese, Terry Gilliam, Eric Idle, Terry Jones, Michael Palin, Mike Myers, Graham Chapman, Stephen Hawking"
80147923,"South Korea, United States",,"Brody Allen, Jenna Davis, Ryan Bartley, Philece Sampler, Leigh Kelly, Abby Trott"
80103426,Spain,David Serrano,"Hugo Silva, Michelle Jenner, Ernesto Sevilla, Belén Cuesta, Óscar Ladoire, Ilay Kurelovic, Verónica Forqué, Luis Jaspe, Borja Luna, José Luis Marín"
70140438,United Kingdom,,"Kaya Scodelario, Hannah Murray, Jack O'Connell, Kathryn Prescott, Lily Loveless, Nicholas Hoult, Joe Dempsie, Mike Bailey, April Pearson, Will Merrick, Freya Mavor, Laya Lewis, Ollie Barbieri, Dakota Blue Richards, Sean Teale, Larissa Wilson, Dev Patel, Mitch Hewer, Luke Pasqualino, Giles Thomas"
80998967,United States,Kate Melville,"Tiya Sircar, Chad Connell, Marco Grazzini, Jesse Camacho, Mark Camacho, Elana Dunkelman, Kelly Hope Taylor, Kenny Wong, Daniela Sandiford, Christina Tannous"
81010662,Japan,,"Yui Ishikawa, Takehito Koyasu, Daisuke Namikawa, Aya Endo, Kouki Uchiyama, Minori Chihara, Haruka Tomatsu, Yoko Hikasa"
80119235,Brazil,Lô Politi,"Jesuíta Barbosa, Laura Neiva, Criolo, Ana Cecília Costa, João Fábio Cabral, Ariclenes Barroso, Karol Conká, Chay Suede, Luciana Souza, Chris Couto, Roberto Berindelli"
60027942,United States,John Ford,"Henry Fonda, Jane Darwell"
80155812,"Turkey, France, Germany, Poland",Yesim Ustaoglu,"Funda Eryiğit, Ecem Uzun, Mehmet Kurtulus, Okan Yalabik, Serkan Keskin, Sema Poyraz"
80226236,South Korea,Choi Jin-seong,
20258084,India,Rajkumar Santoshi,"Aamir Khan, Salman Khan, Raveena Tandon, Karisma Kapoor, Paresh Rawal, Viju Khote, Shehzad Khan, Deven Verma, Jagdeep, Mehmood"
80127990,Brazil,Marcelo Galvão,"Diogo Morgado, Etienne Chicot, Maria de Medeiros, Deto Montenegro, Jonas Leite, Paulo Gorgulho, Will Roberts, Allan Lima, Eduardo Galvão, Igor Galvão"
80039813,United States,,"Elizabeth Banks, Lake Bell, H. Jon Benjamin, Michael Ian Black, Michael Cera, Josh Charles, Bradley Cooper, Judah Friedlander, Janeane Garofalo, Jon Hamm, Nina Hellman, Joe Lo Truglio, Ken Marino, Christopher Meloni, A.D. Miles, Marguerite Moreau, Zak Orth, Jordan Peele, David Hyde Pierce, Chris Pine, Amy Poehler, Paul Rudd, Marisa Ryan, Jason Schwartzman, Molly Shannon, Michael Showalter, John Slattery, Kevin Sussman, David Wain, Kristen Wiig"
80032842,Nigeria,Kunle Afolayan,"Sadiq Daba, David Bailie, Kayode Olaiya, Kehinde Bankole, Fabian Adeoye Lojede, Nick Rhys, Kunle Afolayan, Colin David Reese, Ibrahim Shatta, Femi Adebayo, Kanayo O. Kanayo, Lawrence Stubbings, Ademola Adedoyin"
81146011,United States,Vlad Yudin,Calum Von Moger
70178618,United States,David R. Ellis,"Sara Paxton, Dustin Milligan, Chris Carmack, Katharine McPhee, Donal Logue, Joshua Leonard, Sinqua Walls, Chris Zylka, Alyssa Diaz, Joel David Moore"
80002999,Australia,,"Dan Spielman, Ashley Zukerman, Adele Perovic, Adam Garcia, Chelsie Preston Crayford, Paul Tassone, Dan Wyllie, Lucy Lawless, Aden Young, David Wenham"
80165849,India,Soumendra Padhi,"Manoj Bajpayee, Mayur Mahendra Patole, Tillotama Shome, Shruti Marathe, Chaya Kadam, Gajraj Rao"
70114043,India,Kedar Shinde,"Ankush Choudhary, Smita Shewale, Mohan Joshi, Atmaram Bhende, Asha Bhende"
80094260,Canada,,"Mike Smith, John Paul Tremblay, Robb Wells"
70074100,United States,Jonathan Levine,"Anson Mount, Edwin Hodge, Michael Welch, Brooke Bloom, Amber Heard, Aaron Himelstein, Whitney Able, Luke Grimes, Melissa Price"
80202273,United States,Greg Pritikin,"Chevy Chase, Richard Dreyfuss, Andie MacDowell, Kate Micucci, Chris Parnell, George Wallace, Lewis Black"
80209553,South Korea,,"Yoo Jae-suk, Ahn Jae-wook, Kim Jong-min, Lee Kwang-soo, Park Min-young, Sehun, Kim Se-jeong"
80201590,,,"Kaya Scodelario, January Jones, Will Kemp, Willow Shields, Evan Roderick, David James Elliott, Sarah Wright Olsen, Svetlana Efremova, Amanda Zhou, Mitchell Edwards, Kaitlyn Leeb, Johnny Weir"
80020772,"United Kingdom, United States",Christopher Smith,"Jodie Whittaker, Warwick Davis, Jim Broadbent, Stephen Graham, Nonso Anozie, Rafe Spall, Ewen Bremner, Matt King"
81059816,United Kingdom,,Ben Fogle
81001887,United States,Michael Bay,"Ryan Reynolds, Mélanie Laurent, Corey Hawkins, Dave Franco, Adria Arjona, Manuel Garcia-Rulfo, Ben Hardy, Lior Raz, Payman Maadi, Yuri Kolokolnikov, Kim Kold"
80235524,United States,Steve Ball,"Elyse Maloway, Vincent Tong, Erin Mathews, Andrea Libman, Alessandro Juliani, Nicole Anthony, Diana Kaarina, Ian James Corlett, Britt McKillip, Kathleen Barr, Gigi Saul Guerrero, Brian Drummond"
80144358,United Kingdom,Richard Mears,Julie Walters
80173625,United States,"Linda Saffire, Adam Schlesinger","Peter Martins, Sean Suozzi, Gretchen Smith, Ashley Laracey, Tiler Peck, Damian Woetzel, Albert Evans, Sterling Hyltin, Craig Hall, Peter Boal, Karen Young, Michelle Rodriguez, Jock Soto, Adam Barrett"
81217438,"Canada, India",Sanjay Patel,"Rahul Bhat, Tillotama Shome, Haresh Dagiya, Jayesh More, Tirth Sharma, Vivek Ghamande, Jay Vithlani, Mehul Buch"
80158168,United States,,"Maritza Rodríguez, Carlos Ponce, Marimar Vega, Adriana Barraza, Marcela Guirado, Ricardo Abarca, Thali García, Alexandra Pomales, Briggitte Bozzo, Santiago Torres, Patricio Gallardo, Roberto Escobar, Samantha Dagnino, Raury Rolander, Vince Miranda, Javier Valcárcel"
60021590,United States,Lewis Milestone,"Frank Sinatra, Dean Martin, Sammy Davis Jr., Peter Lawford, Angie Dickinson, Richard Conte, Cesar Romero, Patrice Wymore, Joey Bishop"
80118004,Norway,Benjamin Ree,Magnus Carlsen
70229046,India,"Abbas Alibhai Burmawalla, Mastan Alibhai Burmawalla","Anil Kapoor, Saif Ali Khan, John Abraham, Deepika Padukone, Jacqueline Fernandez, Ameesha Patel, Rajesh Khattar, Chunky Pandey"
80022632,Canada,,"Jennette McCurdy, Jesse Carere, Ryan Allen, Justin Kelly, Kyle Mac, Jack Murray, Brooke Palsson, Jim Watson, Wesley Morgan, Krystal Hope Nausbaum, Shailene Garnett, Canute Gomes, Sarah Podemski, Shailyn Pierre-Dixon, Jesse Bostick, Steven Grayhm, Percy Hynes White, Mercedes Morris, Samantha Munro"
80111556,Taiwan,,"Danson Tang, Chia-ying Lee, Jolin Chien, Jenna Wang, Meng-sheng Shen, Wen-lin Fang, Wei Lin, Phoebe Huang"
80041601,United Kingdom,,"Johnny Flynn, Antonia Thomas, Daniel Ings, Hannah Britland, Joshua McGuire, Richard Thomson, Jessica Ellerby"
80064521,United States,Vlad Yudin,Jeremy Scott
80244547,Israel,Oded Raz,"Guy Amir, Hanan Savyon, Itzik Cohen, Igal Naor"
80185427,,,"Lan Cheng-lung, Esther Yeh, He Yu-chen, Greg Han"
81121179,United States,Peter Fison,Doug Averill
81072516,India,A.R. Murugadoss,"Vijay, Varalakshmi Sarathkumar, Keerthi Suresh, Radha Ravi, Pala Karuppaiah, Yogi Babu"
70221085,United Kingdom,,"Becci Gemmell, Susan Cookson, Mark Benton, Mykola Allen, Sophie Ward, Jo Woodcock, Seline Hizli, Liam Boyle, Danny Webb, Nicholas Shaw, Carolyn Pickles, David Schofield, Summer Strallen, Christine Bottomley"
60020891,United States,Ted Demme,"Johnny Depp, Penélope Cruz, Franka Potente, Rachel Griffiths, Paul Reubens, Jordi Mollà, Cliff Curtis, Miguel Sandoval, Ethan Suplee, Ray Liotta"
80997858,Hong Kong,Wong Jing,"Carol 'Do Do' Cheng, Maggie Cheung, Wilson Lam, Chan Pak-cheung, Charlie Cho, Tom Poon, Kwan Ming-yuk, Hon Yee-Sang, Sherman Wong, Lo Fan"
80104648,India,Sabir Khan,"Tiger Shroff, Shraddha Kapoor, Sudheer Babu, Paras Arora, Sunil Grover, Sourav Chakraborty, Shaurya Bhardawaj"
80018294,United States,,"Charlie Cox, Deborah Ann Woll, Elden Henson, Rosario Dawson, Vincent D'Onofrio, Jon Bernthal, Elodie Yung, Scott Glenn, Stephen Rider, Vondie Curtis-Hall, Ayelet Zurer, Toby Leonard Moore, Bob Gunton"
70304187,Canada,"Mike Smith, John Paul Tremblay, Robb Wells","Mike Smith, John Paul Tremblay, Robb Wells, John Dunsworth, Pat Roach, Leigh MacInnis, Luke Gordon"
80103512,Spain,Ibai Abad,"Lewis Rainer, Josephine Berry, Charlotte Atkinson, Charles MacGechan"
60003401,India,Satish Kaushik,"Anil Kapoor, Aishwarya Rai Bachchan, Sonali Bendre, Puru Rajkumar, Anupam Kher, Satish Kaushik, Mukesh Rishi, Jaspal Bhatti, Razak Khan, Himani Shivpuri, Smita Jaykar, Tanaaz Currim Irani"
81004374,"Belgium, Netherlands",Lukas Dhont,"Victor Polster, Arieh Worthalter, Oliver Bodart, Tijmen Govaerts, Katelijne Damen, Valentijn Dhaenens, Magali Elali, Alice de Broqueville, Chris Thys, Angelo Tijssens"
80188969,Taiwan,,"Crowd Lu, Tsai Chen-nan, Lotus Wang, Fan Chu-Mei, Hsieh Ying-shiuan, Vera Yen, Cammy Chiang"
80160935,Mexico,,"Verónica Castro, Aislinn Derbez, Cecilia Suárez, Dario Yazbek Bernal, Paco León, Arturo Ríos, Juan Pablo Medina, Verónica Langer, Lucas Velázquez"
81083791,Canada,Julien Christian Lutz,"Sarah Jeffery, Simon Paul Mutuyimana, Denis Theriault, Jeremiah Sparks, Steven Love, Cara Ricketts, Jim Codrington, Shamier Anderson, Stephan James, Lanette Ware, Hugh Thompson"
70114588,India,Umesh Shukla,"Paresh Rawal, Kunal Khemu, Sonu Sood, Soha Ali Khan, Johnny Lever, Dilip Joshi, Asrani, Malay Chakrabarty, Razak Khan, Hrishitaa Bhatt"
80123729,United Kingdom,,"Indira Varma, Robert Glenister, Dino Fetscher, Neil Stuke, Christiane Paul, Lesley Sharp, Kevin Doyle"
80178941,United States,,"Lauren Lapkus, Stephanie Lemelin, Kelly McCreary, Atticus Shaffer, Danny Pudi, Grey Griffin, Utkarsh Ambudkar, Roger Craig Smith"
60027716,United States,Troy Miller,"Eric Christian Olsen, Derek Richardson, Rachel Nichols, Cheri Oteri, Luis Guzmán, Elden Henson, William Lee Scott, Mimi Rogers, Eugene Levy"
70100527,Hong Kong,Cheh Chang,"Meng Lo, Sheng Chiang, Li Wang, Siu-Ho Chin, Feng Lu, Chien Sun, Hsueh-erh Wen, Tai-Ping Yu"
81022003,United States,,Boulet Brothers
80238391,Mexico,,"Alejandro Speitzer, Minnie West, Jorge Caballero, Ana González Bello, Axel Arenas, Arcelia Ramírez, Omar Germenos, Anna Ciocchetti, Aurora Gil, Martha Julia, Alejandro Puente, Estrella Solís, Martín Saracho, Sofía de Llaca, Marco Tostado"
80020131,United States,"Steve Ball, Andrew Duncan","Kate Higgins, Debi Derryberry, Salli Saffioti, Evan Smith, Laura Bailey, Audu Paden, Erin Fitzgerald, Cindy Robinson, Ogie Banks, Cam Clarke"
70031792,United States,Nicholas Ray,"James Dean, Natalie Wood, Sal Mineo, Jim Backus, Ann Doran, Corey Allen, William Hopper, Rochelle Hudson, Dennis Hopper, Edward Platt"
80244246,,,"Nawat Kulrattanarak, Woranuch Wongsawan, Jespipat Tilapornputt, Paramej Noiam, Phutharit Prombandal"
80000139,"United States, Japan, Canada",,"Erin Mathews, Sam Vincent, Andrea Libman, Ashleigh Ball, Ian James Corlett, Brian Drummond, Lee Tockar, Matt Hill"
81035860,Egypt,Ismail Farouk,"Sameh Hussain, Hasan Abdulfattah, Sulayman Id, Ayten Amer, Hassan Hosny"
81035835,Egypt,Mohamed Samy,"Mohamed Ramadan, Dina El-Sherbiny, Eyad Nassar, Sayed Rajab, Walid Fawaz, Eman El-Assy"
80134682,Australia,Scott Hicks,
80244709,Australia,Jeffrey Walker,"Osamah Sami, Don Hany, Helana Sawires, Frances Duca, Majid Shokor, Rodney Afif, Ghazi Alkinani, Ryan Corr"
70136129,"Ireland, Canada, United States, United Kingdom",,"Jonathan Rhys Meyers, Henry Cavill, James Frain, Anthony Brophy, Guy Carleton, Sarah Bolger, Natalie Dormer, Max Brown, Nick Dunning, Rod Hallett, Maria Doyle Kennedy, Simon Ward"
80058851,India,Amitoj Mann,"Harbhajan Mann, Manpneet Grewal, Ashish Duggal, Girja Shankar, Shavinder Mahal, Rupinder Roopi, Anita Meet, Tarsem Paul, Balkaran Wadding, Bobby Sandhu"
60000861,"United States, Canada",Mary Harron,"Christian Bale, Willem Dafoe, Jared Leto, Reese Witherspoon, Samantha Mathis, Chloë Sevigny, Justin Theroux, Josh Lucas, Matt Ross, Bill Sage, Cara Seymour, Guinevere Turner"
80114855,United States,,"Jonathan Groff, Holt McCallany, Anna Torv, Cotter Smith, Hannah Gross"
80204401,,,"Michael Mosley, James Wong"
80115338,United States,,"Jennifer Garner, Shayle Simons, Vania Gill, Islie Hirvonen, Brendon Sunderland, Austin Abell, Evans Johnson, Kathleen Barr, David Hoole"
70101696,United States,Edward Zwick,"Daniel Craig, Liev Schreiber, Jamie Bell, Alexa Davalos, Allan Corduner, Mark Feuerstein, Tomas Arana, Jodhi May, Kate Fahy, Iddo Goldberg, George MacKay, Iben Hjejle, Martin Hancock, Jacek Koman, Ravil Isyanov"
80167459,United States,Mary Mazzio,Jessica Chastain
81020728,Taiwan,,"June Tsai, Ray Chang, Lung Shao-hua, Yi-Wen Yen, Ching-kuan Wang, Mai Sato"
81093951,India,B. V. Nandini Reddy,"Samantha Ruth Prabhu, Lakshmi, Rajendraprasad, Naga Shourya, Rao Ramesh, Teja Sajja, Pragathi, Jagapathi Babu, Aishwarya, Urvashi"
80201868,,,"Christine McConnell, Colleen Smith, Adam Mayfield, Michael Oosterom, Drew Massey, Mick Ignis, Tim Lagasse, Dita von Teese, Steven M. Porter, Elko Weaver"
80108844,Taiwan,,"Ethan Juan, Cheryl Yang, Harry Chang, Sylvia Yang, James Wen, Patrick Lee"
80995737,United States,Ryan Polito,Deon Cole
80116839,United States,,"Cameron Dallas, Aaron Carpenter, Taylor Caniff, Willie Jones, Trey Schafer, Bart Bordelon, Blake Gray"
80087857,Argentina,,"Fabio Aste, Héctor Segura, Sebastian Rosas"
80991879,Spain,,
70241088,India,B. Unnikrishnan,"Mithra Kurian, Anoop Menon, Mohanlal, Narein, Priyamani, Roma, Siddique, Jagathy Sreekumar"
80208083,France,"Benjamin Cohen, Nicolas Cotto",
80179371,United States,,"Christina Ochoa, Matt Barr, Corbin Reid, Charlie Barnett, W. Tré Davis"
80057700,United States,Austin Stark,"Nicolas Cage, Sarah Paulson, Connie Nielsen, Wendell Pierce, Bryan Batt, Peter Fonda, Dana Gourrier"
81012340,France,Jean-Bernard Marlin,"Dylan Robert, Kenza Fortas, Idir Azougli, Lisa Amedjout, Sofia Bent, Nabila Bounad, Kader Benchoudar, Nabila Ait Amer"
607931,United States,Jocelyn Moorhouse,"Winona Ryder, Anne Bancroft, Ellen Burstyn, Kate Nelligan, Alfre Woodard, Kaelynn Craddick, Sara Craddick, Kate Capshaw, Dermot Mulroney, Adam Baldwin, Maya Angelou, Rip Torn, Joanna Going, Claire Danes, Jean Simmons, Denis Arndt, Johnathon Schaech, Samantha Mathis, Derrick O'Connor, Jared Leto"
80121871,,,"Ekta Kaul, Ashish Sharma, Kanan Malhotra, Sukirti Kandpal"
80032178,United States,,"James Purefoy, Michael Kenneth Williams, Jimmi Simpson, Bill Sage, Christina Hendricks, Pollyanna McIntosh, Jeff Pope, Neil Sandilands, Henry G. Sanders, Enrique Murciano"
80175314,United States,Ian MacAllister-McDonald,"Thomas Mann, Lily Mae Harrington, Ely Henry, Lachlan Buchanan, Marin Ireland, John Thorsen, Stephen Thorne, Shannon Hartman"
80227554,United Kingdom,,"Lee Dixon, Ian Wright, Paul Merson"
81169914,United States,,Reese Witherspoon
81136744,United States,John Murlowski,"Joel Courtney, Calum Worthy, Andi Matichak, Katherine McNamara, Cam Gigandet, Mason McNulty, Terry Dale Parks, Vito Viscuso, Jennifer Pierce Mathus, Kevin Remington"
81172866,,Falz,"Falz, Adunni Ade, Bisola Aiyeola, Frank Donga"
80236408,,,"Nida Patcharaveerapong, Nicole Theriault, Nattapol Diloknawarit, Tosatid Darnkhuntod, Narupornkamol Chaisang, Pavadee Komchokpaisan, Kawin Manonukul, Ponlawit Ketprapakorn, Rudklao Amratisha, Paramej Noiam, Tachakorn Boonlupyanun, Teera Pratumtree, Nawarat Techarathanaprasert, Naphon Phromsuwan"
70293315,"United States, Spain, Chile, Peru",Eli Roth,"Ignacia Allamand, Daryl Sabara, Nicolás Martínez, Lorenza Izzo, Ariel Levy, Magda Apanowicz, Sky Ferreira, Kirby Bliss Blanton, Aaron Burns, Ramón Llao, Richard Burgi"
80196382,United Kingdom,,"Lisa Ambalavanar, Ellie Duckles, Savannah Baker, Cian Barry, Eleanor Bennett, Jacob Dudman, Rosie Dwyer, Jack Kane, Max Lohan, Nneka Okoye, Micheal Ward, Georgina Sadler, Indianna Ryan"
81002876,United States,Nicholaus Goossen,Nikki Glaser
18002692,United States,Tony Kaye,"Edward Norton, Edward Furlong, Beverly D'Angelo, Jennifer Lien, Ethan Suplee, Fairuza Balk, Avery Brooks, Elliott Gould, Stacy Keach, William Russ, Guy Torry"
81050190,United States,Svetlana Cvetko,"Teri Polo, Dylan Walsh, Danika Yarosh, Hayley McLaughlin, Bryce Durfee, Matt Passmore, Heather Mazur, Ashlyn Pearce"
81211681,,Lucas Margutti,"Luccas Neto, Vivian Duarte, Giobanna Alparone, Jéssica Diehl"
80135587,United Kingdom,,
60033300,"Canada, United States",Gavin O'Connor,"Kurt Russell, Patricia Clarkson, Noah Emmerich, Sean McCann, Kenneth Welsh, Eddie Cahill, Patrick O'Brien Demsey, Michael Mantenuto, Nathan West, Kenneth Mitchell, Sam Skoryna, Billy Schneider, Michael Kopsa, Beverley Breuer, Lisa Marie Caruk, Ryan Walter, Nate Miller, Joseph Cure, Scott Johnson, Eric Peter-Kaiser, Bobby Hanson"
80997339,Japan,,"Yuto Uemura, Takahiro Sakurai, Kenyu Horiuchi, Nanako Mori, Yusuke Kobayashi, Shunsuke Takeuchi, Junji Majima, Rie Takahashi, Hinata Tadokoro, Kenjiro Tsuda, Takehito Koyasu, Sayaka Ohara, Nobuo Tobita"
80217946,,,
70293820,"Italy, France",Gianfranco Rosi,
80168028,"Argentina, Uruguay, Spain, France",Israel Adrián Caetano,"Leonardo Sbaraglia, Daniel Hendler, Ángela Molina, Alián Devetac, Pablo Cedrón, Alejandra Flechner"
80162131,,,"Eun-mi Go, Jaehyo, Eun-Hyung Jo, Ha-yeon Kim, Shin Yi, Kwang-sun Park"
70035037,Indonesia,Nia Dinata,"Cut Mini Theo, Tora Sudiro, Aida Nurmala, Surya Saputra, Rachel Maryam Sayidina, Trey Gondokusumo, Lili Harahap, Aurora Yahya, Wilza Lubis, Nico Siahaan"
81011449,United States,,"Erinn Hayes, Rob Huebel, Malin Akerman, Rob Corddry, Lake Bell, Sarayu Blue, Ken Marino, Fred Melamed, Tom Wright, Jason Schwartzman, Eric Nenninger, Megan Le, Beth Dover, Zandy Hartig, Brian Huskey, Michael Cera"
81206389,India,Parthiban,Parthiban
70084799,United States,Steven Spielberg,"Harrison Ford, Cate Blanchett, Karen Allen, Ray Winstone, John Hurt, Jim Broadbent, Igor Jijikine, Shia LaBeouf"
70229042,India,Sameer Sharma,"Kunal Kapoor, Huma Qureshi, Rajesh Sharma, Vipin Sharma, Dolly Ahluwalia, Vinod Nagpal, Rahul Bagga, Rajendra Sethi, Munish Makhija, Herry Tangri"
81025218,,,Samantha Armstrong
80107989,"Ireland, United Kingdom, United States",Noam Murro,"James McAvoy, Nicholas Hoult, John Boyega, Ben Kingsley, Tom Wilkinson, Gemma Arterton, Peter Capaldi, Olivia Colman, Mackenzie Crook, Anne-Marie Duff, Taron Egerton, James Faulkner, Freddie Fox, Lee Ingleby, Miles Jupp, Daniel Kaluuya, Rory Kinnear, Craig Parkinson, Rosamund Pike, Daniel Rigby, Jason Watkins"
81014239,,,"Paul Hollywood, Mary Berry, Mel Giedroyc, Sue Perkins"
80176265,"United Kingdom, Singapore",,"Nadia Ramlee, Chio Su-Ping, Jeremy Linn, Marlon Dance-Hooi"
70236020,India,Sujoy Ghosh,"Vidya Balan, Parambrata Chatterjee, Dhritiman Chatterjee, Saswata Chatterjee, Indraneil Sengupta, Nawazuddin Siddiqui, Darshan Jariwala, Masood Akhtar, Riddhi Sen"
80187205,China,Derek Hui,"Takeshi Kaneshiro, Zhou Dongyu, Sun Yizhou, Ming Xi, Tony Yang, Lin Chi-ling"
81066723,India,Bumpy,
80223317,India,"Surya S.J., Sunil Kumar Agrawal","Fardeen Khan, Kareena Kapoor, Amrish Puri, Navin Nischol, Beena, Anup Soni, Johnny Lever, Sharat Saxena, Amitabh Bachchan, Sakshi Shivanand"
80107084,United States,David Wain,"Will Forte, Domhnall Gleeson, Martin Mull, Joel McHale, Matt Lucas, Thomas Lennon, Seth Green, Jackie Tohn, Natasha Lyonne, Emmy Rossum, Elvy Yost, Matt Walsh, John Gemberling, Rick Glassman, Camille Guaty"
80144588,United States,,
80195049,United States,Alex Richanbach,"Gillian Jacobs, Vanessa Bayer, Phoebe Robinson, Richard Madden, Michaela Watkins, Félix Gómez"
81020612,,,"Andy Chen, Mandy Wei, Jolin Chien, Mandy Tao, Kris Shen, Nylon Chen"
81041391,"France, Netherlands, Singapore",Yeo Siew Hua,"Peter Yu, Liu Xiaoyi, Guo Yue, Ishtiaque Zico, Jack Tan"
80011848,United States,David Sampliner,David Sampliner
80157565,"Chile, Spain, Argentina, Germany",Matías Bize,"Elena Anaya, Benjamín Vicuña, Néstor Cantillana, Sergio Hernández, Silvia Marty, Etienne Bobenrieth, Antonia Zegers, Pablo Cerda"
80019930,United States,"William Lau, Sylvain Blais","Cam Clarke, Audu Paden, Laura Bailey, Cindy Robinson, Erin Fitzgerald, Kate Higgins, Salli Saffioti, Sue Swan, Haviland Stillwell, Paula Rhodes, America Young, Stephanie Sheh, Josey Montana McCoy"
80165854,India,Luv Ranjan,"Kartik Aaryan, Divyendu Sharma, Raayo S. Bakhirta, Nushrat Bharucha, Sonalli Sehgall, Ishita Raj"
80197462,United States,,"Colin Ford, Alyvia Alyn Lind, Sophie Simnett, Austin Crute, Cody Kearsley, Jeanté Godlock, Gregory Kasyan, Krysta Rodriguez, Matthew Broderick"
81049674,Egypt,,"Ameena Khalil, Zafer Abdeen, Injy El Mokkaddem, Khaled Kamal, Cherif Hafez, Carmen Bsaibes, Mourad Makram, Leila Ezz Al Arab, Asmaa Abou El Yazeed, Nadine Nassib Njeim"
81082125,United Kingdom,,David Attenborough
80172284,Italy,Alex Infascelli,
80243408,India,Neeraj Pandey,"Sidharth Malhotra, Manoj Bajpayee, Rakul Preet Singh, Pooja Chopra, Adil Hussain, Kumud Mishra, Naseeruddin Shah, Anupam Kher, Vikram Gokhale, Juhi Babbar"
70301367,"United States, Australia","Lana Wachowski, Lilly Wachowski","Mila Kunis, Channing Tatum, Sean Bean, Eddie Redmayne, Douglas Booth, Tuppence Middleton, Nikki Amuka-Bird, Christina Cole, James D'Arcy, Gugu Mbatha-Raw"
80999989,Thailand,Note Chern-Yim,"Pongsak Pongsuwan, Note Chern-Yim, Sarawut Phumthong, Savika Chaiyadej, Somlek Sakdikul, Petchtai Wongkamlao"
81167101,,,"Taecyeon, Seo Ye-ji, Cho Seong-ha, Woo Do‑hwan, Son Byung-ho, Kim Kwang-gyoo, Yun Yoo-sun, Park Ji-young, Jeong Hae-gyoon, Jang Hyeok-jin"
70158330,United States,,"Avery Brooks, Nana Visitor, Rene Auberjonois, Cirroc Lofton, Alexander Siddig, Colm Meaney, Armin Shimerman, Terry Farrell, Michael Dorn"
70109758,India,Dibakar Banerjee,"Abhay Deol, Paresh Rawal, Neetu Chandra, Archana Puran Singh, Manu Rishi Chadha, Richa Chadda, Anurag Arora, Rajender Sethi, Manjot Singh, Chandan Anand"
81217738,India,KVR Mahendra,"Anand Deverakonda, Shivatmika Rajasekhar, Kannada Kishore"
80161728,United States,,"Tom Cullen, Jim Carter, Pádraic Delaney, Simon Merrells, Julian Ovenden, Olivia Ross, Ed Stoppard, Sabrina Bartlett, Bobby Schofield, Sarah-Sofie Boussnina"
80217743,United Kingdom,,Melvin Odoom
81002601,Vietnam,Van M. Pham,"Phuong Mai, Quang Su, Hoang Phuc Nguyen, Chi Pu, Tien Pham, Hoai An"
81011973,India,Rajesh Touchriver,"Siddique, Anjali Patil, Lakshmi Menon, Nina Kurup, Rathna Shekar Reddy, Anoop Aravindan"
80132411,United States,Ari Levinson,Chris Pine
80202908,India,Sudesh Manjrekar,"Bharat Jadhav, Ankush Chaudhari, Siddarth Jadhav, Santosh Juvekar, Vaibhav Mangale, Kranti Redkar, Manava Naik"
80995079,,,"Anamaya Verma, Ganesh Divekar, Jigna Bharadhwaj, Jitendra Dasadiva, Manoj Pandey, Manish Bhuvan, Meena Nahta, Neshma Chemburkar, Saumya Daan, Sonal Kaushal"
80065182,United States,,"Jake McDorman, Jennifer Carpenter, Hill Harper, Mary Elizabeth Mastrantonio, Ron Rifkin, Blair Brown, Bradley Cooper"
70116577,India,Sanjay Soorkar,"Ashok Saraf, Sonali Kulkarni, Subodh Bhave, Usha Nadkarni, Raghavendra Kadkol, Pushkar Shrotri, Lokesh Gupte, Santosh Juvekar, Jyoti Joshi, Kishor Mahabole"
80136452,,,"Loo Aye Keng, Chen Ke Mei, Hady, Hishiko Woo, Jiang Pei Pei, Steve Yap"
